title,abstract,url,publication_year,authors,institutions
Artificial intelligence in healthcare robots: A social informatics study of knowledge embodiment,"Knowledge embodiment, taking a social informatics perspective, refers to the transformation of knowledge into a form in which its value becomes evident. Knowledge embodiment in robotic systems with artificial intelligence (AI robotic systems) actualizes the value of knowledge much more powerfully than other entities, potentially altering the connections among people or even displacing professionals. To understand the effects of knowledge embodiment in AI robotic systems on connections among people and technology, this study addresses 2 cumulative research questions: (i) What is the nature of knowledge embodiment, that is, how are knowledge and AI robots assembled for knowledge work? (ii) How does knowledge embodiment affect connections among people and technology (that is, social informatics)? A case study of a large hospital that has employed different AI robotic systems in many parts of its healthcare service provision process indicates 4 forms of knowledge embodiment, each with a distinct focus. Further, a social informatics analysis suggests four ways knowledge embodiment affects connections among people and technology and reveals related social and institutional issues that go beyond technological determinism. Implications of these findings for research on social informatics and information science are discussed.",https://openalex.org/W2907512083,2018,Loo Geok Pee; Shan L. Pan; Lili Cui,Nanyang Technological University; UNSW Sydney; Shanghai University of Finance and Economics
"Assessment of Awareness, Perceptions, and Opinions towards Artificial Intelligence among Healthcare Students in Riyadh, Saudi Arabia","Background and Objective: The role of the pharmacist in healthcare society is unique, since they are providers of health information and medication counseling to patients. Hence, this study aimed to evaluate Awareness, Perceptions, and Opinions towards Artificial intelligence (AI) among pharmacy undergraduate students at King Saud University (KSU), Riyadh, Saudi Arabia. Materials and Methods: A cross-sectional, questionnaire-based study was conducted between December 2022 and January 2023 using online questionnaires. The data collection was carried out using convenience sampling methods among senior pharmacy students at the College of Pharmacy, King Saud University. Statistical Package for the Social Sciences version 26 was used to analyze the data (SPSS). Results: A total of one hundred and fifty-seven pharmacy students completed the questionnaires. Of these, most of them (n = 118; 75.2%) were males. About 42%, (n = 65) were in their fourth year of study. Most of the students (n = 116; 73.9%) knew about AI. In addition, 69.4% (n = 109) of the students thought that AI is a tool that helps healthcare professionals (HCP). However, more than half 57.3% (n = 90) of the students were aware that AI would assist healthcare professionals in becoming better with the widespread use of AI. Furthermore, 75.1% of the students agreed that AI reduces errors in medical practice. The mean positive perception score was 29.8 (SD = 9.63; range-0–38). The mean score was significantly associated with age (p = 0.030), year of study (p = 0.040), and nationality (p = 0.013). The gender of the participants was found to have no significant association with the mean positive perception score (p = 0.916). Conclusions: Overall, pharmacy students showed good awareness of AI in Saudi Arabia. Moreover, the majority of the students had positive perceptions about the concepts, benefits, and implementation of AI. Moreover, most students indicated that there is a need for more education and training in the field of AI. Consequently, early exposure to content related to AI in the curriculum of pharmacy is an important step to help in the wide use of these technologies in the graduates’ future careers.",https://openalex.org/W4366990875,2023,Wajid Syed; Mahmood Basil A. Al‐Rawi,King Saud University
Artificial intelligence (AI) healthcare technology innovations: the current state and challenges from a life science industry perspective,"The purpose of this study is to assess innovation system performance and identify the system-blocking mechanisms for AI healthcare technology innovations related to the life science industry. The socio-technical analytical framework Technological innovation systems (TIS) was used to assess the structural and functional dynamics of AI healthcare technology innovations related to the life science industry in West Sweden. The case study employs a mixed-method research approach, triangulating qualitative and quantitative data from secondary published sources and interviews with 21 experts and 25 life science business executives. The results reveal that innovation system performance is primarily restricted by the system weaknesses of limited resources and insufficient communication from leading healthcare professionals regarding their needs for improving healthcare using AI technology innovations. This study shows that to improve innovation system performance, policy interventions intended to increase available resources and to formulate vision and mission statements to improve healthcare with AI technology innovations may be encouraged. This study contributes to the understanding of the mechanisms and interdependencies between system functions using the socio-technical TIS framework in a healthcare context.",https://openalex.org/W3201541319,2021,Petra Apell; Henrik Eriksson,Chalmers University of Technology
Student perspectives on the integration of artificial intelligence into healthcare services,"Background Healthcare workers are often overworked, underfunded, and face many challenges. Integration of artificial intelligence into healthcare service provision can tackle these challenges by relieving burdens on healthcare workers. Since healthcare students are our future healthcare workers, we assessed the knowledge, attitudes, and perspectives of current healthcare students at Qatar University on the implementation of artificial intelligence into healthcare services. Methods This was a cross-sectional study of QU-Health Cluster students via an online survey over a three-week period in November 2021. Chi-squared tests and gamma coefficients were used to compare differences between categorical variables. Results One hundred and ninety-three QU-Health students responded. Most participants had a positive attitude towards artificial intelligence, finding it useful and reliable. The most popular perceived advantage of artificial intelligence was its ability to speed up work processes. Around 40% expressed concern about a threat to job security from artificial intelligence, and a majority believed that artificial intelligence cannot provide sympathetic care (57.9%). Participants who felt that artificial intelligence can better make diagnoses than humans also agreed that artificial intelligence could replace their job (p = 0.005). Male students had more knowledge (p = 0.005) and received more training (p = 0.005) about healthcare artificial intelligence. Participants cited a lack of expert mentorship as a barrier to obtaining knowledge about artificial intelligence, followed by lack of dedicated courses and funding. Conclusions More resources are required for students to develop a good understanding about artificial intelligence. Education needs to be supported by expert mentorship. Further work is needed on how best to integrate artificial intelligence teaching into university curricula.",https://openalex.org/W4379057663,2023,Muna N Ahmad; Saja A Abdallah; Saddam Akber Abbasi,Qatar University; University of Birmingham
An Open Science Approach to Artificial Intelligence in Healthcare,"Objectives: Artificial Intelligence (AI) offers significant potential for improving healthcare. This paper discusses how an “open science” approach to AI tool development, data sharing, education, and research can support the clinical adoption of AI systems. Method: In response to the call for participation for the 2019 International Medical Informatics Association (IMIA) Yearbook theme issue on AI in healthcare, the IMIA Open Source Working Group conducted a rapid review of recent literature relating to open science and AI in healthcare and discussed how an open science approach could help overcome concerns about the adoption of new AI technology in healthcare settings. Results: The recent literature reveals that open science approaches to AI system development are well established. The ecosystem of software development, data sharing, education, and research in the AI community has, in general, adopted an open science ethos that has driven much of the recent innovation and adoption of new AI techniques. However, within the healthcare domain, adoption may be inhibited by the use of “black-box” AI systems, where only the inputs and outputs of those systems are understood, and clinical effectiveness and implementation studies are missing. Conclusions: As AI-based data analysis and clinical decision support systems begin to be implemented in healthcare systems around the world, further openness of clinical effectiveness and mechanisms of action may be required by safety-conscious healthcare policy-makers to ensure they are clinically effective in real world use.",https://openalex.org/W2940709043,2019,Chris Paton; Shinji Kobayashi,University of Oxford; Open Source Drug Discovery; Kyoto University
Recent Advances of Artificial Intelligence in Healthcare: A Systematic Literature Review,"The implementation of artificial intelligence (AI) is driving significant transformation inside the administrative and clinical workflows of healthcare organizations at an accelerated rate. This modification highlights the significant impact that AI has on a variety of tasks, especially in health procedures relating to early detection and diagnosis. Papers done in the past imply that AI has the potential to increase the overall quality of services provided in the healthcare industry. There have been reports that technology based on AI can improve the quality of human existence by making life simpler, safer, and more productive. A comprehensive analysis of previous scholarly research on the use of AI in the health area is provided in this research in the form of a literature review. In order to propose a classification framework, the review took into consideration 132 academic publications sourced from scholarly sources. The presentation covers both the benefits and the issues that AI capabilities provide for individuals, medical professionals, corporations, and the health industry. In addition, the social and ethical implications of AI are examined in the context of the output of value-added medical services for decision-making processes in healthcare, privacy and security measures for patient data, and health monitoring capabilities.",https://openalex.org/W4382058325,2023,Fotis Kitsios; Maria Kamariotou; Aristomenis Syngelakis,University of Macedonia; European University Cyprus; National and Kapodistrian University of Athens
A framework for examining patient attitudes regarding applications of artificial intelligence in healthcare,"Background While use of artificial intelligence (AI) in healthcare is increasing, little is known about how patients view healthcare AI. Characterizing patient attitudes and beliefs about healthcare AI and the factors that lead to these attitudes can help ensure patient values are in close alignment with the implementation of these new technologies. Methods We conducted 15 focus groups with adult patients who had a recent primary care visit at a large academic health center. Using modified grounded theory, focus-group data was analyzed for themes related to the formation of attitudes and beliefs about healthcare AI. Results When evaluating AI in healthcare, we found that patients draw on a variety of factors to contextualize these new technologies including previous experiences of illness, interactions with health systems and established health technologies, comfort with other information technology, and other personal experiences. We found that these experiences informed normative and cultural beliefs about the values and goals of healthcare technologies that patients applied when engaging with AI. The results of this study form the basis for a theoretical framework for understanding patient orientation to applications of AI in healthcare, highlighting a number of specific social, health, and technological experiences that will likely shape patient opinions about future healthcare AI applications. Conclusions Understanding the basis of patient attitudes and beliefs about healthcare AI is a crucial first step in effective patient engagement and education. The theoretical framework we present provides a foundation for future studies examining patient opinions about applications of AI in healthcare.",https://openalex.org/W4220954134,2022,Jordan Richardson; Susan Curtis; Cambray Smith,Mayo Clinic in Florida
Artificial Intelligence in Healthcare: Perception and Reality,"Artificial intelligence (AI) has birthed the new ""big thing"" in modern medicine. It promises to bring about safer and improved care that will be beneficial to patients and become a helpful tool in the hands of a skilled physician. Despite its anticipation, however, the implementation and usage of AI are still in their elementary phases, particularly due to legal and ethical considerations that border on ""data."" These challenges should not be brushed aside but rather be recognized and resolved to enable acceptance by all relevant stakeholders without prejudice. Once these challenges can be overcome, AI will truly revolutionize the field of medicine with improved diagnostic accuracy, a reduction in physician burnout, and an enhanced treatment modality. It is therefore paramount that AI be embraced by physicians and integrated into medical education in order to be well-prepared for our role in the future of medicine.",https://openalex.org/W4386889960,2023,Abidemi O Akinrinmade; Temitayo M Adebile; Chioma Ezuma-Ebong,Babcock University; Boston Medical Center; Georgia Southern University
ARTIFICIAL INTELLIGENCE IN HEALTHCARE,"Technologies based on artificial intelligence (AI) and machine learning (ML) are widely considered to have the potential to transform healthcare – by deriving new and important insights from the vast amount of data generated during the delivery of healthcare on a daily basis. These technologies are expected to significantly improve the quality of care that patients receive. An important factor for the further development and application of solutions based on AI and ML is the regulatory and legal framework. This chapter explains what AI is, how it works and what benefits it could bring in the life sciences and healthcare sectors. Several use cases of AI in healthcare are examined – from diagnostics to clinical trials and surgery robotics. The chapter also provides a thorough analysis of, and suggestions for overcoming, the main legal challenges surrounding the use of AI in healthcare, including the overarching regulatory framework, product liability issues, protection of intellectual property rights, as well as reimbursement issues.",https://openalex.org/W3095372540,2020,Roland Wiring,
Knowledge and perception of healthcare workers towards the adoption of artificial intelligence in healthcare service delivery in Nigeria,"Background: Artificial Intelligence (AI) is seen as the machine that replaces human labour to work for men with a more effective and speedier result. There is a paucity of data on the knowledge and perception of healthcare workers regarding AI technology. This study aims to assess the knowledge and perception of healthcare workers towards the application of AI in healthcare services in Nigeria. Materials and methods: Cross-sectional questionnaire-based survey designed was used to achieve the aim of this study. Both electronic (Google form) and hardcopy version of the questionnaire were distributed to healthcare workers in Nigeria and their responses were retrieved and statistically analyzed. Results: Out of 263 respondents, most 51.3% (n=135) were females. Greater percentage 25.5% (n=67) of the respondents were radiographers, followed by medical consultants 14.8% (n=39) and the least 1.5 %(n=4) were pharmacists. Greater proportion 61 %(n=160) of the respondents has the opinion that AI can be incorporated into all medical specialties. Out of 263 respondents, 51.7% (n=136) had good knowledge of AI and the least 6.4% (n=16) had very poor knowledge of AI. Greater proportion 78.7% (n=207) of the respondents, agreed that AI can help to reduce the number of medical errors. Majority 29.3% (n=77) of the respondents agreed that human specialists will be replaced by AI in the near future. A large proportion 40.3% (n=106) of the respondents agreed that some employers may prefer AI to human specialists because AI has no emotional exhaustion or physical limitation. Conclusion: The respondents in this study showed good knowledge of both the medical areas of applications of AI as well as the benefits of AI application in healthcare services. However, most of the respondents were afraid that their jobs would be taken over by AI in the near future",https://openalex.org/W4392648747,2023,Michael Promise Ogolodom; Anna Daniel Ochong; Egop Brownson Egop,Rivers State University
Public perceptions on the application of artificial intelligence in healthcare: a qualitative meta-synthesis,"Objectives Medical artificial intelligence (AI) has been used widely applied in clinical field due to its convenience and innovation. However, several policy and regulatory issues such as credibility, sharing of responsibility and ethics have raised concerns in the use of AI. It is therefore necessary to understand the general public’s views on medical AI. Here, a meta-synthesis was conducted to analyse and summarise the public’s understanding of the application of AI in the healthcare field, to provide recommendations for future use and management of AI in medical practice. Design This was a meta-synthesis of qualitative studies. Method A search was performed on the following databases to identify studies published in English and Chinese: MEDLINE, CINAHL, Web of science, Cochrane library, Embase, PsycINFO, CNKI, Wanfang and VIP. The search was conducted from database inception to 25 December 2021. The meta-aggregation approach of JBI was used to summarise findings from qualitative studies, focusing on the public’s perception of the application of AI in healthcare. Results Of the 5128 studies screened, 12 met the inclusion criteria, hence were incorporated into analysis. Three synthesised findings were used as the basis of our conclusions, including advantages of medical AI from the public’s perspective, ethical and legal concerns about medical AI from the public’s perspective, and public suggestions on the application of AI in medical field. Conclusion Results showed that the public acknowledges the unique advantages and convenience of medical AI. Meanwhile, several concerns about the application of medical AI were observed, most of which involve ethical and legal issues. The standard application and reasonable supervision of medical AI is key to ensuring its effective utilisation. Based on the public’s perspective, this analysis provides insights and suggestions for health managers on how to implement and apply medical AI smoothly, while ensuring safety in healthcare practice. PROSPERO registration number CRD42022315033.",https://openalex.org/W4313482890,2023,Chenxi Wu; Huiqiong Xu; Dingxi Bai,Chengdu University of Traditional Chinese Medicine; Sichuan University
"Clinicians’ Views on Using Artificial Intelligence in Healthcare: Opportunities, Challenges, and Beyond","AI technology has the potential to revolutionize healthcare through its integration with EHRs and other existing technologies. However, several challenges must be addressed before this potential can be fully realized. The development and testing of complex EHR systems that utilize AI must be approached with care to ensure their accuracy and trustworthiness in decision-making about patient treatment. Additionally, there is a need to navigate medico-legal obligations and ensure that benefits are equitably distributed.",https://openalex.org/W4386732338,2023,Abdullah Alanazi,King Abdullah International Medical Research Center; King Saud bin Abdulaziz University for Health Sciences
Review of study reporting guidelines for clinical studies using artificial intelligence in healthcare,"High-quality research is essential in guiding evidence-based care, and should be reported in a way that is reproducible, transparent and where appropriate, provide sufficient detail for inclusion in future meta-analyses. Reporting guidelines for various study designs have been widely used for clinical (and preclinical) studies, consisting of checklists with a minimum set of points for inclusion. With the recent rise in volume of research using artificial intelligence (AI), additional factors need to be evaluated, which do not neatly conform to traditional reporting guidelines (eg, details relating to technical algorithm development). In this review, reporting guidelines are highlighted to promote awareness of essential content required for studies evaluating AI interventions in healthcare. These include published and in progress extensions to well-known reporting guidelines such as Standard Protocol Items: Recommendations for Interventional Trials-AI (study protocols), Consolidated Standards of Reporting Trials-AI (randomised controlled trials), Standards for Reporting of Diagnostic Accuracy Studies-AI (diagnostic accuracy studies) and Transparent Reporting of a multivariable prediction model for Individual Prognosis Or Diagnosis-AI (prediction model studies). Additionally there are a number of guidelines that consider AI for health interventions more generally (eg, Checklist for Artificial Intelligence in Medical Imaging (CLAIM), minimum information (MI)-CLAIM, MI for Medical AI Reporting) or address a specific element such as the ‘learning curve’ (Developmental and Exploratory Clinical Investigation of Decision-AI) . Economic evaluation of AI health interventions is not currently addressed, and may benefit from extension to an existing guideline. In the face of a rapid influx of studies of AI health interventions, reporting guidelines help ensure that investigators and those appraising studies consider both the well-recognised elements of good study design and reporting, while also adequately addressing new challenges posed by AI-specific elements.",https://openalex.org/W3196173279,2021,Susan C. Shelmerdine; Owen J. Arthurs; Alastair K. Denniston,Great Ormond Street Hospital for Children NHS Foundation Trust; University of Birmingham
Multi-stakeholder preferences for the use of artificial intelligence in healthcare: A systematic review and thematic analysis,"While overall positivity persists in attitudes and preferences toward AI use in healthcare, some prevalent problems require more attention. There is a need to go beyond addressing algorithm-related issues to look at the translation of legislation and guidelines into practice to ensure fairness, accountability, transparency, and ethics in AI.",https://openalex.org/W4388347968,2023,Vinh Vo; Gang Chen; Yves Saint James Aquino,Monash University; University of Wollongong
The Application of Digital Technologies and Artificial Intelligence in Healthcare: An Overview on Nutrition Assessment,"In the last decade, artificial intelligence (AI) and AI-mediated technologies have undergone rapid evolution in healthcare and medicine, from apps to computer software able to analyze medical images, robotic surgery and advanced data storage system. The main aim of the present commentary is to briefly describe the evolution of AI and its applications in healthcare, particularly in nutrition and clinical biochemistry. Indeed, AI is revealing itself to be an important tool in clinical nutrition by using telematic means to self-monitor various health metrics, including blood glucose levels, body weight, heart rate, fat percentage, blood pressure, activity tracking and calorie intake trackers. In particular, the application of the most common digital technologies used in the field of nutrition as well as the employment of AI in the management of diabetes and obesity, two of the most common nutrition-related pathologies worldwide, will be presented.",https://openalex.org/W4384340821,2023,Alessia Salinari; Michele Machì; Yasmany Armas Díaz,Marche Polytechnic University
