title,abstract,url,publication_year,authors,institutions
Artificial Intelligence in Finance & Investing: State-of-the-Art Technologies for Securities Selection and Portfolio Management,"From the Publisher:
In Artificial Intelligence in Finance and Investing, authors Robert Trippi and Jae Lee explain this fascinating new technology in terms that portfolio managers, institutional investors, investment analysis, and information systems professionals can understand. Using real-life examples and a practical approach, this rare and readable volume discusses the entire field of artificial intelligence of relevance to investing, so that readers can realize the benefits and evaluate the features of existing or proposed systems, and ultimately construct their own systems. Topics include using Expert Systems for Asset Allocation, Timing Decisions, Pattern Recognition, and Risk Assessment; overview of Popular Knowledge-Based Systems; construction of Synergistic Rule Bases for Securities Selection; incorporating the Markowitz Portfolio Optimization Model into Knowledge-Based Systems; Bayesian Theory and Fuzzy Logic System Components; Machine Learning in Portfolio Selection and Investment Timing, including Pattern-Based Learning and Fenetic Algorithms; and Neural Network-Based Systems. To illustrate the concepts presented in the book, the authors conclude with a valuable practice session and analysis of a typical knowledge-based system for investment management, K-FOLIO. For those who want to stay on the cutting edge of the application revolution, Artificial Intelligence in Finance and Investing offers a pragmatic introduction to the use of knowledge-based systems in securities selection and portfolio management.",https://openalex.org/W378411239,1995,Robert R. Trippi; Jae K. Lee,
Decision Support and Business Intelligence Systems,"Decision Support and Business Intelligence Systems 9e provides the only comprehensive, up-to-date guide to today's revolutionary management support system technologies, and showcases how they can be used for better decision-making. KEY TOPICS: Decision Support Systems and Business Intelligence. Decision Making, Systems, Modeling, and Support. Decision Support Systems Concepts, Methodologies, and Technologies: An Overview. Modeling and Analysis. Data Mining for Business Intelligence. Artificial Neural Networks for Data Mining. Text and Web Mining. Data Warehousing. Collaborative Computer-Supported Technologies and Group Support Systems. Knowledge Management. Artificial Intelligence and Expert Systems. Advanced Intelligent Systems. Management Support Systems: Emerging Trends and Impacts. Ideal for practicing managers interested in the foundations and applications of BI, group support systems (GSS), knowledge management, ES, data mining, intelligent agents, and other intelligent systems.",https://openalex.org/W1595853162,2006,Efraim Turban; Ramesh Sharda; Dursun Delen,
Artificial Intelligence and Machine Learning in the Diagnosis and Management of Stroke: A Narrative Review of United States Food and Drug Administration-Approved Technologies,"Stroke is an emergency in which delays in treatment can lead to significant loss of neurological function and be fatal. Technologies that increase the speed and accuracy of stroke diagnosis or assist in post-stroke rehabilitation can improve patient outcomes. No resource exists that comprehensively assesses artificial intelligence/machine learning (AI/ML)-enabled technologies indicated for the management of ischemic and hemorrhagic stroke. We queried a United States Food and Drug Administration (FDA) database, along with PubMed and private company websites, to identify the recent literature assessing the clinical performance of FDA-approved AI/ML-enabled technologies. The FDA has approved 22 AI/ML-enabled technologies that triage brain imaging for more immediate diagnosis or promote post-stroke neurological/functional recovery. Technologies that assist with diagnosis predominantly use convolutional neural networks to identify abnormal brain images (e.g., CT perfusion). These technologies perform comparably to neuroradiologists, improve clinical workflows (e.g., time from scan acquisition to reading), and improve patient outcomes (e.g., days spent in the neurological ICU). Two devices are indicated for post-stroke rehabilitation by leveraging neuromodulation techniques. Multiple FDA-approved technologies exist that can help clinicians better diagnose and manage stroke. This review summarizes the most up-to-date literature regarding the functionality, performance, and utility of these technologies so clinicians can make informed decisions when using them in practice.",https://openalex.org/W4380225038,2023,Anirudha S. Chandrabhatla; Elyse A. Kuo; Jennifer D. Sokolowski,Neurological Surgery; University of Virginia
"Exploring the Relationship between Abusive Management, Self-Efficacy and Organizational Performance in the Context of Human–Machine Interaction Technology and Artificial Intelligence with the Effect of Ergonomics","(1) Background: Our study aims to explore the impact of abusive management and self-efficacy on corporate performance in the context of artificial intelligence-based human–machine interaction technology in enterprise performance evaluation. (2) Methods: Surveys were distributed to 578 participants in selected international companies in Turkey, Taiwan, Japan, and China. To reduce uncertainty and errors, the surveys were rigorously evaluated and did not show a normal distribution, as it was determined that 85 participants did not consciously fill out the questionnaires, and the questionnaires from the remaining 493 participants were used. By using the evaluation model of employee satisfaction based on a back propagation (BP) neural network, we explored the manifestation and impact of abusive management and self-efficacy. Using the listed real estate businesses as an example, we proposed a deep learning BP neural network-based employee job satisfaction evaluation model and a human–machine technology-based employee performance evaluation system under situational perception, according to the design requirements of human–machine interaction. (3) Results: The results show that the human–machine interface can log in according to the correct verbal instructions of the employees. In terms of age and education level variables, employees’ perceptions of leaders’ abusive management and self-efficacy are significantly different from their job performances, respectively (p &lt; 0.01). (4) Conclusions: artificial intelligence (AI)-based human–machine interaction technology, malicious management, and self-efficacy directly affect enterprise performance and employee satisfaction.",https://openalex.org/W4211220224,2022,Shanyu Lin; Esra Sipahi Döngül; Serdar Vural Uygun,Fuzhou University; Aksaray University; Nevşehir Hacı Bektaş Veli University
Technology Adoption and Human Resource Management Practices: The Use of Artificial Intelligence for Recruitment in Bangladesh,"Artificial intelligence (AI) is now considered indispensable in undertaking operational activities, especially in the area of human resource analytics. However, in practice, the rate of the adoption of such modern algorithms in organisations is still in its early stages. Consequently, the primary objective of this study is to identify the main antecedents of the adoption of AI-based technologies in recruitment, using the lens of the unified theory of acceptance and use of technology (UTAUT) model, alongside perceived credibility and moderating variables, in the context of an emerging nation in South Asia, namely Bangladesh. Data were collected from 283 human resource professionals employed in different manufacturing and service firms in Bangladesh through the administration of a questionnaire, which was analysed by applying PLS-SEM. The outcomes of the study show that all the direct hypothesised relationships were found to be significant, apart from the extended variable of perceived credibility. However, no moderating effect of gender or firm size was found in any of the hypothesised propositions. Finally, policy implications and recommendations for future researchers are proposed.",https://openalex.org/W4300972495,2022,Muhaiminul Islam; Abdullah Al Mamun; Samina Afrin,University of Dhaka; University of Chittagong
Integrating artificial intelligence for knowledge management systems – synergy among people and technology: a systematic review of the evidence,"This paper analyses Artificial Intelligence (AI) and Knowledge Management (KM) and focuses primarily on examining to what degree AI can help companies in their efforts to handle information and manage knowledge effectively. A search was carried out for relevant electronic bibliographic databases and reference lists of relevant review articles. Articles were screened and the eligibility was based on participants, procedures, comparisons, outcomes (PICO) model, and criteria for PRISMA (Preferred Reporting Items for Systematic Reviews). The results reveal that knowledge management and AI are interrelated fields as both are intensely connected to knowledge; the difference reflects in how – while AI offers machines the ability to learn, KM offers a platform to better understand knowledge. The research findings further point out that communication, trust, information systems, incentives or rewards, and the structure of an organization; are related to knowledge sharing in organizations. This systematic literature review is the first to throw light on KM practices &amp; the knowledge cycle and how the integration of AI aids knowledge management systems, enterprise performance &amp; distribution of knowledge within the organization. The outcomes offer a better understanding of efficient and effective knowledge resource management for organizational advantage. Future research is necessary on smart assistant systems thus providing social benefits that strengthen competitive advantage. This study indicates that organizations must take note of definite KM leadership traits and organizational arrangements to achieve stable performance through KM.",https://openalex.org/W4223608520,2022,Rashmi Yogesh Pai; Ankitha Shetty; Adithya D. Shetty,Manipal Academy of Higher Education
Business intelligence for strategic management in a technology-oriented company,"Business Intelligence (BI) is a tool that supports proactive strategic management and decision making by producing actionable information that enables the identification of emerging changes. A human-source intelligence network consisting of an organisation's frontline employees is a valuable intelligence asset as the employees possess early and interpreted information about the business environment. The aim of the paper is to consider how this information can be effectively utilised in the BI process and further, to analyse how BI can be smoothly integrated in the process of strategic management. To achieve these objectives, literature research and case study approaches are applied. The case study examines a technology-oriented, global telecommunications company to obtain a pragmatic and insightful view and to improve the understanding of the research issue so sparsely covered in the literature. As a managerial implication, the authors suggest the establishment of an intelligence process and a network in the case company.",https://openalex.org/W2062183589,2006,Maria Viitanen; Virpi Pirttimäki,Tampere University of Applied Sciences
Application of Artificial Intelligence-based Technology in Cancer Management: A Commentary on the Deployment of Artificial Neural Networks,"Artificial intelligence was recognised many years ago as a potential and powerful tool to predict disease outcome in many clinical situations. The conventional approaches using statistical methods have provided much information, but are subject to limitations imposed by the complexity of medical data. The structures of the important variants of the machine learning system artificial neural networks (ANN) are discussed and emphasis is given to the powerful analytical support that could be provided by ANN for the prediction of cancer progression and prognosis. The predictive ability of the cellular markers, DNA ploidy and cell-cycle profiles, and molecular markers, such as tumour promoter and suppressor gene, and growth factor and steroid hormone receptors in breast cancer management were also analysed. ANN systems have been successfully deployed to evaluate microRNA profiles of tumours which saliently sway cancer progression and prognosis of the disease, thus counteracting the negative implications of their numerical abundance. Finally, in this setting, the prospective technical improvements in artificial neural networks, as hybrid systems in combination with fuzzy logic and artificial immune networks were also addressed.",https://openalex.org/W2902895195,2018,Gajanan V. Sherbet; Wai Lok Woo; Satnam Dlay,Institute for Molecular Medicine; Newcastle University
DEVELOPING INNOVATION CAPABILITY IN ORGANISATIONS: A DYNAMIC CAPABILITIES APPROACH,"This paper draws together knowledge from a variety of fields to propose that innovation management can be viewed as a form of organisational capability. Excellent companies invest and nurture this capability, from which they execute effective innovation processes, leading to innovations in new product, services and processes, and superior business performance results. An extensive review of the literature on innovation management, along with a case study of Cisco Systems, develops a conceptual model of the firm as an innovation engine. This new operating model sees substantial investment in innovation capability as the primary engine for wealth creation, rather than the possession of physical assets. Building on the dynamic capabilities literature, an ""innovation capability"" construct is proposed with seven elements. These are vision and strategy, harnessing the competence base, organisational intelligence, creativity and idea management, organisational structures and systems, culture and climate, and management of technology.",https://openalex.org/W2101348440,2001,Benn Lawson; Danny Samson,The University of Melbourne
The adoption of technology management principles and artificial intelligence for a sustainable lean construction industry in the case of Bahrain,"The concept of lean management has been of interest to researchers and practitioners in the construction industry and is implemented in most countries. While achieving waste mitigation in developed countries, lean is still in its elementary stages in the Middle East. Moreover, the implementation in the Middle East poses more challenges than benefit when choosing the right lean tools and techniques for projects. This study will critically investigate the factors affecting the process of adopting lean tools and techniques, which are directed towards technology, artificial intelligence and IoT in the construction industry in the public sector in the four governates of the Kingdom of Bahrain. Thereafter, the investigation will determine the level of lean construction management implementation and consequently its effect on sustainability using a quantitative method. The result from the questionnaire is hoped to shed a light on the poorly researched topic in Bahrain and benefit academics and practitioners.",https://openalex.org/W4282966053,2022,Aysha Aljawder; Wafi Al‐Karaghouli,Ahlia University; Brunel University of London
Artificial Intelligence and Smart Technologies in Safety Management: A Comprehensive Analysis Across Multiple Industries,"The integration of Artificial Intelligence (AI) and smart technologies into safety management is a pivotal aspect of the Fourth Industrial Revolution or Industry 4.0. This study conducts a systematic literature review to identify and analyze how AI and smart technologies enhance safety management across various sectors within the Safety 4.0 paradigm. Focusing on peer-reviewed journal articles that explicitly mention “Smart”, “AI”, or “Artificial Intelligence” in their titles, the research examines key safety management factors, such as accident prevention, risk management, real-time monitoring, and ethical implementation, across sectors, including construction, industrial safety, disaster and public safety, transport and logistics, energy and power, health, smart home and living, and other diverse industries. AI-driven solutions, such as predictive analytics, machine learning algorithms, IoT sensor integration, and digital twin models, are shown to proactively identify and mitigate potential hazards, optimize energy consumption, and enhance operational efficiency. For instance, in the energy and power sector, intelligent gas meters and automated fire suppression systems manage gas-related risks effectively, while in the health sector, AI-powered health monitoring devices and mental health support applications improve patient and worker safety. The analysis reveals a significant trend towards shifting from reactive to proactive safety management, facilitated by the convergence of AI with IoT and Big Data analytics. Additionally, ethical considerations and data privacy emerge as critical challenges in the adoption of AI technologies. The study highlights the transformative role of AI in enhancing safety protocols, reducing accident rates, and improving overall safety outcomes across industries. It underscores the need for standardized protocols, robust AI governance frameworks, and interdisciplinary research to address existing challenges and maximize the benefits of AI in safety management. Future research directions include developing explainable AI models, enhancing human–AI collaboration, and fostering global standardization to ensure the responsible and effective implementation of AI-driven safety solutions.",https://openalex.org/W4405642324,2024,Jiyoung Park; Dongheon Kang,Wonkwang University; Ministry of Health and Welfare; National Rehabilitation Center
Impact of Artificial Intelligence–Based Technology on Nurse Management: A Systematic Review,"Aim: To describe the use of artificial intelligence (AI) by nurse managers to enhance management, leadership, and healthcare outcomes. Background: AI represents a significant transformation in healthcare management by enhancing decision‐making, communication, and resource optimization. However, the integration and strategic application of AI in nursing management are underexplored, particularly regarding its impact on leadership roles and healthcare delivery. Methods: Methodological guidelines described by PRISMA were followed, and quality was assessed using the Joanna Briggs Institute (JBI) methodology. The databases searched included the Web of Science, Scopus, CINAHLi, and PubMed. The review included quantitative, qualitative, and mixed‐method studies published between January 2015 and April 2024. Results: Fourteen studies were selected for the review. The key findings indicate that AI technologies facilitate better resource management, risk assessment, and decision‐making. AI also supports nurse managers in leading changes, enhancing communication, and optimizing administrative tasks. Conclusion: AI has been progressively integrated into nursing management, demonstrating significant benefits in operational efficiency, decision support, and leadership enhancement. However, challenges, such as resistance to technological change and ethical complexities, need to be addressed. Implications for Nursing Management: Specific training programs for nurse managers are essential to optimize the integration of AI. Such programs should focus on the management of AI applications and data analyses. In addition, creating interdisciplinary groups involving nurse managers, AI developers, and nursing staff is crucial for tailoring AI solutions to meet the unique needs of healthcare settings.",https://openalex.org/W4403360708,2024,A. García; Silvia Pérez‐González; Carmen Benavides,Universidad de León
Human Resource Management and Technology Development in Artificial Intelligence Adoption in the UAE Energy Sector,"Abstract Artificial Intelligence (AI) is proved a very effective technique in reducing complexity and making suitable quick decisions for achieving success. Artificial Intelligence is an emerging area and growing fast. It is used successfully in various fields. In UAE also, AI is being used in several sectors. Now the government of UAE has promoted AI in the energy sector to get the maximum of its benefits. Hence, this study evaluated various indicators that affect the promotion of AI in the energy section of the UAE. With the help of a questionnaire survey, 350 questionnaire forms were analyzed to prioritize the parameters affecting AII adoption. From the analysis results it was found that “Organization use AI to provide effective business innovation”, “Organizations use AI to align with its business strategy”, and “Organization use AI to improve the levels of production” are the key motivating factor to adopt AI. Significant parameters of AI technology include are; AI Technology is user friendly, AI Technology is able to improve the quality of the work and AI Technology fits well with the tasks involved; are reported as significant technological parameters to adopt AI. On the other hand, Referral person is required if facing difficulty with AI technology, and teammate support in using AI technology are essential parameters of the human resource management which affect AI adoption in the energy sector of the UAE. In addition, reliability and normality tests validated the data. Hence, these findings can be used to promote AI and understand the situation for making proper decisions.",https://openalex.org/W4200245483,2021,Hassan Ali Hassan Altaffaq Almarashda; Ishak Baba; Azizul Azhar Ramli,Tun Hussein Onn University of Malaysia
Research Framework for Determining How Artificial Intelligence Enables Information Technology Service Management for Business Model Resilience,"Information technology service management (ITSM) driven by artificial intelligence (AI), i.e., AITSM, is likely to change business models and enterprise operations substantially, setting off a wave of enterprise AI transformation. Empowerment from AI has brought new vitality and challenges to ITSM capabilities, and enterprises must start thinking about how the capability of AITSM can be reactivated to shape the resilience of business models and meet survival needs in complex and ever-changing environments. To systematically achieve the development of enterprise business model resilience under AITSM, this study combines the actual situation of ITSM and enterprise AI transformation practice and then deconstruct it into three sub-research questions along the primary line of driver identification–model construction–paradigm optimization. We retrieve high-quality literature in the field of information systems from common databases and discuss the topics of AITSM and business model resilience. This study finds that future research should focus on forming an accurate description of the resilience demand of business models in the current era, and thus, better explain the value cocreation process between AITSM and business units. In addition, future research should emphasize the dynamic and strategic nature of business model resilience to study the continuous optimization of business models with the help of AITSM.",https://openalex.org/W3210874863,2021,Hongyi Mao; Tao Zhang; Qing Tang,Guizhou University of Finance and Economics; Sichuan Agricultural University
