title,abstract,url,publication_year,authors,institutions
Operationalising ethics in artificial intelligence for healthcare: a framework for AI developers,"Abstract Artificial intelligence (AI) offers much promise for improving healthcare. However, it runs the looming risk of causing individual and societal harms; for instance, exacerbating inequalities amongst minority groups, or enabling compromises in the confidentiality of patients’ sensitive data. As such, there is an expanding, unmet need for ensuring AI for healthcare is developed in concordance with human values and ethics. Augmenting “principle-based” guidance that highlight adherence to ethical ideals (without necessarily offering translation into actionable practices), we offer a solution-based framework for operationalising ethics in AI for healthcare. Our framework is built from a scoping review of existing solutions of ethical AI guidelines, frameworks and technical solutions to address human values such as self-direction in healthcare. Our view spans the entire length of the AI lifecycle: data management, model development, deployment and monitoring. Our focus in this paper is to collate actionable solutions (whether technical or non-technical in nature), which can be steps that enable and empower developers in their daily practice to ensuring ethical practices in the broader picture. Our framework is intended to be adopted by AI developers, with recommendations that are accessible and driven by the existing literature. We endorse the recognised need for ‘ethical AI checklists’ co-designed with health AI practitioners, which could further operationalise the technical solutions we have collated. Since the risks to health and wellbeing are so large, we believe a proactive approach is necessary for ensuring human values and ethics are appropriately respected in AI for healthcare.",https://openalex.org/W4285799063,2022,Pravik Solanki; John Grundy; Waqar Hussain,Monash University
Health Information Management: Implications of Artificial Intelligence on Healthcare Data and Information Management,"Objective: This paper explores the implications of artificial intelligence (AI) on the management of healthcare data and information and how AI technologies will affect the responsibilities and work of health information management (HIM) professionals. Methods: A literature review was conducted of both peer-reviewed literature and published opinions on current and future use of AI technology to collect, store, and use healthcare data. The authors also sought insights from key HIM leaders via semi-structured interviews conducted both on the phone and by email. Results: The following HIM practices are impacted by AI technologies: 1) Automated medical coding and capturing AI-based information; 2) Healthcare data management and data governance; 3) Fbtient privacy and confidentiality; and 4) HIM workforce training and education. Discussion: HIM professionals must focus on improving the quality of coded data that is being used to develop AI applications. HIM professional’s ability to identify data patterns will be an important skill as automation advances, though additional skills in data analysis tools and techniques are needed. In addition, HIM professionals should consider how current patient privacy practices apply to AI application, development, and use. Conclusions: AI technology will continue to evolve as will the role of HIM professionals who are in a unique position to take on emerging roles with their depth of knowledge on the sources and origins of healthcare data. The challenge for HIM professionals is to identify leading practices for the management of healthcare data and information in an AI-enabled world.",https://openalex.org/W2968508357,2019,Mary H Stanfill; David T. Marc,College of St. Scholastica
Artificial intelligence with multi-functional machine learning platform development for better healthcare and precision medicine,"Abstract Precision medicine is one of the recent and powerful developments in medical care, which has the potential to improve the traditional symptom-driven practice of medicine, allowing earlier interventions using advanced diagnostics and tailoring better and economically personalized treatments. Identifying the best pathway to personalized and population medicine involves the ability to analyze comprehensive patient information together with broader aspects to monitor and distinguish between sick and relatively healthy people, which will lead to a better understanding of biological indicators that can signal shifts in health. While the complexities of disease at the individual level have made it difficult to utilize healthcare information in clinical decision-making, some of the existing constraints have been greatly minimized by technological advancements. To implement effective precision medicine with enhanced ability to positively impact patient outcomes and provide real-time decision support, it is important to harness the power of electronic health records by integrating disparate data sources and discovering patient-specific patterns of disease progression. Useful analytic tools, technologies, databases, and approaches are required to augment networking and interoperability of clinical, laboratory and public health systems, as well as addressing ethical and social issues related to the privacy and protection of healthcare data with effective balance. Developing multifunctional machine learning platforms for clinical data extraction, aggregation, management and analysis can support clinicians by efficiently stratifying subjects to understand specific scenarios and optimize decision-making. Implementation of artificial intelligence in healthcare is a compelling vision that has the potential in leading to the significant improvements for achieving the goals of providing real-time, better personalized and population medicine at lower costs. In this study, we focused on analyzing and discussing various published artificial intelligence and machine learning solutions, approaches and perspectives, aiming to advance academic solutions in paving the way for a new data-centric era of discovery in healthcare.",https://openalex.org/W3011742849,2020,Zeeshan Ahmed; Khalid Gaffer Mohamed; Saman Zeeshan,"Rutgers Health; Johnson University; Rutgers, The State University of New Jersey"
Application of Artificial Intelligence-Based Technologies in the Healthcare Industry: Opportunities and Challenges,"This study examines the current state of artificial intelligence (AI)-based technology applications and their impact on the healthcare industry. In addition to a thorough review of the literature, this study analyzed several real-world examples of AI applications in healthcare. The results indicate that major hospitals are, at present, using AI-enabled systems to augment medical staff in patient diagnosis and treatment activities for a wide range of diseases. In addition, AI systems are making an impact on improving the efficiency of nursing and managerial activities of hospitals. While AI is being embraced positively by healthcare providers, its applications provide both the utopian perspective (new opportunities) and the dystopian view (challenges to overcome). We discuss the details of those opportunities and challenges to provide a balanced view of the value of AI applications in healthcare. It is clear that rapid advances of AI and related technologies will help care providers create new value for their patients and improve the efficiency of their operational processes. Nevertheless, effective applications of AI will require effective planning and strategies to transform the entire care service and operations to reap the benefits of what technologies offer.",https://openalex.org/W3113541070,2021,DonHee Lee; Seong No Yoon,Inha University; Edward Waters University
Artificial intelligence in healthcare delivery: Prospects and pitfalls,"This review provides a comprehensive examination of the integration of Artificial Intelligence (AI) into healthcare, focusing on its transformative implications and challenges. Utilising a systematic search strategy across electronic databases such as PubMed, Scopus, Embase, and Sciencedirect, relevant peer-reviewed articles published in English between January 2010 till date were identified. Findings reveal AI's significant impact on healthcare delivery, including its role in enhancing diagnostic precision, enabling treatment personalisation, facilitating predictive analytics, automating tasks, and driving robotics. AI algorithms demonstrate high accuracy in analysing medical images for disease diagnosis and enable the creation of tailored treatment plans based on patient data analysis. Predictive analytics identify high-risk patients for proactive interventions, while AI-powered tools streamline workflows, improving efficiency and patient experience. Additionally, AI-driven robotics automate tasks and enhance care delivery, particularly in rehabilitation and surgery. However, challenges such as data quality, interpretability, bias, and regulatory frameworks must be addressed for responsible AI implementation. Recommendations emphasise the need for robust ethical and legal frameworks, human-AI collaboration, safety validation, education, and comprehensive regulation to ensure the ethical and effective integration of AI in healthcare. This review provides valuable insights into AI's transformative potential in healthcare while advocating for responsible implementation to ensure patient safety and efficacy.",https://openalex.org/W4394859632,2024,David B. Olawade; Aanuoluwapo Clement David-Olawade; Ojima Z. Wada,University of East London; York St John University; University of Derby
Opportunities and challenges of artificial intelligence in healthcare,"In this article, an overview of existing cases of usage of artificial intelligence (hereinafter AI) in healthcare is made, and opportunities of AI technologies and challenges one may face while embedding and using them are studied. In literature, there are several definitions of AI given in different dictionaries and studies. These definitions are mentioned in the article. In the framework of this article, AI is understood as the capability of a machine to imitate intelligent human behavior. The object of the research is AI in healthcare. The goal of the research is to make a representation of current usage of AI in healthcare. The goal is concretized by the following tasks: to classify AI systems used in healthcare and to make a world map of top AI startups in this field. The method used for the research is statistical observation by studying of sources about current projects in AI market.",https://openalex.org/W2968084331,2019,Oksana Iliashenko; Zilia U. Bikkulova; Alissa Dubgorn,Peter the Great St. Petersburg Polytechnic University
Application of uncertainty quantification to artificial intelligence in healthcare: A review of last decade (2013–2023),"Uncertainty estimation in healthcare involves quantifying and understanding the inherent uncertainty or variability associated with medical predictions, diagnoses, and treatment outcomes. In this era of Artificial Intelligence (AI) models, uncertainty estimation becomes vital to ensure safe decision-making in the medical field. Therefore, this review focuses on the application of uncertainty techniques to machine and deep learning models in healthcare. A systematic literature review was conducted using the Preferred Reporting Items for Systematic Reviews and Meta-Analyses (PRISMA) guidelines. Our analysis revealed that Bayesian methods were the predominant technique for uncertainty quantification in machine learning models, with Fuzzy systems being the second most used approach. Regarding deep learning models, Bayesian methods emerged as the most prevalent approach, finding application in nearly all aspects of medical imaging. Most of the studies reported in this paper focused on medical images, highlighting the prevalent application of uncertainty quantification techniques using deep learning models compared to machine learning models. Interestingly, we observed a scarcity of studies applying uncertainty quantification to physiological signals. Thus, future research on uncertainty quantification should prioritize investigating the application of these techniques to physiological signals. Overall, our review highlights the significance of integrating uncertainty techniques in healthcare applications of machine learning and deep learning models. This can provide valuable insights and practical solutions to manage uncertainty in real-world medical data, ultimately improving the accuracy and reliability of medical diagnoses and treatment recommendations.",https://openalex.org/W4386385472,2023,Silvia Seoni; Jahmunah Vicnesh; Massimo Salvi,Polytechnic University of Turin; Nanyang Polytechnic
"Artificial Intelligence and Healthcare: A Journey through History, Present Innovations, and Future Possibilities","Artificial intelligence (AI) has emerged as a powerful tool in healthcare significantly impacting practices from diagnostics to treatment delivery and patient management. This article examines the progress of AI in healthcare, starting from the field’s inception in the 1960s to present-day innovative applications in areas such as precision medicine, robotic surgery, and drug development. In addition, the impact of the COVID-19 pandemic on the acceleration of the use of AI in technologies such as telemedicine and chatbots to enhance accessibility and improve medical education is also explored. Looking forward, the paper speculates on the promising future of AI in healthcare while critically addressing the ethical and societal considerations that accompany the integration of AI technologies. Furthermore, the potential to mitigate health disparities and the ethical implications surrounding data usage and patient privacy are discussed, emphasizing the need for evolving guidelines to govern AI’s application in healthcare.",https://openalex.org/W4395676198,2024,Rahim Hirani; Kaleb Noruzi; Hassan Khuram,New York Medical College; Drexel University
Artificial intelligence for healthcare and medical education: a systematic review.,"In the context of the COVID-19 pandemic, our study provides an innovative systematic review of the latest ""AI+medicine/medical curriculum"". Since the AI+medicine curriculum is not yet regulated, we have made some suggestions.",https://openalex.org/W4385716471,2023,Li Sun; Changhao Yin; Qiuling Xu,Education Department of Heilongjiang Province; Mudanjiang Medical University
Artificial intelligence in healthcare in developing nations: The beginning of a transformative journey,"Introduction: Artificial intelligence (AI) is the fascinating result of the convergence of various technologies, algorithms and approaches. Its role in early detection and diagnosis will be a boon to society in the next few years and should be seen as 'Augmented Intelligence.' Issues like ethical considerations and collaborations need to be sorted out to ensure apt implementation in healthcare. This article reviews the current status of AI in developing nations like India and highlights some insights that could provide new directions and opportunities for AI in healthcare, especially in the field of radiology. Implications for Patient Care: (1) AI will aid in nation-wide research and cooperation that will provide an impetus for the development of imaging science and decentralization of medical services. (2) AI may help to bridge the gap for need of specialized medical personnel in the peripheral areas in developing countries like India. (3) Government initiatives, ethical considerations and joint public private sector collaborations will ensure smooth transition and implementation of AI in healthcare especially in radiology. Summary Statement: This manuscript highlights the existing gap between the developed and developing nations regarding implementation and acceptance of AI in healthcare and at the same time brings out insights in regard to the government initiatives to ease the progress of AI in healthcare in developing countries like India.",https://openalex.org/W2995118024,2019,Abhishek Mahajan; Tanvi Vaidya; Anurag Gupta,Homi Bhabha National Institute; Tata Memorial Hospital
FUTURE-AI: international consensus guideline for trustworthy and deployable artificial intelligence in healthcare,"Despite major advances in artificial intelligence (AI) research for healthcare, the deployment and adoption of AI technologies remain limited in clinical practice. This paper describes the FUTURE-AI framework, which provides guidance for the development and deployment of trustworthy AI tools in healthcare. The FUTURE-AI Consortium was founded in 2021 and comprises 117 interdisciplinary experts from 50 countries representing all continents, including AI scientists, clinical researchers, biomedical ethicists, and social scientists. Over a two year period, the FUTURE-AI guideline was established through consensus based on six guiding principles—fairness, universality, traceability, usability, robustness, and explainability. To operationalise trustworthy AI in healthcare, a set of 30 best practices were defined, addressing technical, clinical, socioethical, and legal dimensions. The recommendations cover the entire lifecycle of healthcare AI, from design, development, and validation to regulation, deployment, and monitoring.",https://openalex.org/W4407173730,2025,Karim Lekadir; Alejandro F. Frangi; Antonio R. Porras,Institució Catalana de Recerca i Estudis Avançats; Universitat de Barcelona; KU Leuven
The Potential Impact of Artificial Intelligence on Healthcare Spending,"The potential of artificial intelligence (AI) to simplify existing healthcare processes and create new, more efficient ones is a major topic of discussion in the industry.Yet healthcare lags other industries in AI adoption.In this paper, we estimate that wider adoption of AI could lead to savings of 5 to 10 percent in US healthcare spending-roughly $200 billion to $360 billion annually in 2019 dollars.These estimates are based on specific AI-enabled use cases that employ today's technologies, are attainable within the next five years, and would not sacrifice quality or access.These opportunities could also lead to non-financial benefits such as improved healthcare quality, increased access, better patient experience, and greater clinician satisfaction.We further present case studies and discuss how to overcome the challenges to AI deployments.We conclude with a review of recent market trends that may shift the AI adoption trajectory toward a more rapid pace.",https://openalex.org/W4317790370,2023,Nikhil R. Sahni; George Stein; Rodney W. Zemmel,Harvard University Press; McKinsey & Company (United States); National Bureau of Economic Research
Artificial intelligence in healthcare institutions: A systematic literature review on influencing factors,"The purpose of this review is integrating and contextualizing relevant literature on the factors influencing the adoption of AI in the healthcare industry into a comprehensive framework. Health systems are considered fundamental to creating societal value. However, global health systems are challenged by the increasing number of patients due to population aging and the growing prevalence of chronic diseases and cancer. Meanwhile, the United Nations calls for equal access to healthcare, tackling costs, and addressing resource constraints to foster the sustainable development of societies. In this context, artificial intelligence (AI) is gaining attention as it constitutes a promising technology to address these burgeoning challenges. Despite opportunities, the literature specifically on the adoption of AI in the healthcare industry is fragmented across various research fields, lacking a comprehensive overview. It lacks theoretically grounded research integrating, for example, the factors that influence the adoption of AI in healthcare institutions.",https://openalex.org/W4389502491,2023,Julia Stefanie Roppelt; Dominik K. Kanbach; Sascha Kraus,HHL Leipzig Graduate School of Management; Woxsen School of Business; Free University of Bozen-Bolzano
Use of Artificial Intelligence in Healthcare Delivery,"In recent years, there has been an amplified focus on the use of artificial intelligence (AI) in various domains to resolve complex issues. Likewise, the adoption of artificial intelligence (AI) in healthcare is growing while radically changing the face of healthcare delivery. AI is being employed in a myriad of settings including hospitals, clinical laboratories, and research facilities. AI approaches employing machines to sense and comprehend data like humans has opened up previously unavailable or unrecognised opportunities for clinical practitioners and health service organisations. Some examples include utilising AI approaches to analyse unstructured data such as photos, videos, physician notes to enable clinical decision making; use of intelligence interfaces to enhance patient engagement and compliance with treatment; and predictive modelling to manage patient flow and hospital capacity/resource allocation. Yet, there is an incomplete understanding of AI and even confusion as to what it is? Also, it is not completely clear what the implications are in using AI generally and in particular for clinicians? This chapter aims to cover these topics and also introduce the reader to the concept of AI, the theories behind AI programming and the various applications of AI in the medical domain.",https://openalex.org/W2887791621,2018,Sandeep Reddy,
The importance of resource awareness in artificial intelligence for healthcare,"Artificial intelligence and machine learning (AI/ML) models have been adopted in a wide range of healthcare applications, from medical image computing and analysis to continuous health monitoring and management. Recent data have demonstrated a clear trend that AI/ML model sizes, as well as their computational complexity, memory consumption and the scale of the required training data and costs, are experiencing an exponential increase. The developments in current computing hardware platforms, storage infrastructure, networking and domain expertise cannot keep up with this exponential growth in resources demanded by the AI/ML models. Here, we first analyse this recent trend and highlight that there are resource sustainability issues in AI/ML for healthcare. We then present various algorithm/system innovations that will help address these issues. We finally outline future directions to proactively and prospectively tackle these resource sustainability issues. Sustainability awareness is lacking in the development of AI systems and algorithms for healthcare. The authors discuss resource sustainability issues in energy, storage and domain knowledge, and present potential solutions.",https://openalex.org/W4380369663,2023,Zhenge Jia; Jianxu Chen; Xiaowei Xu,University of Notre Dame; Leibniz Institute for Analytical Sciences - ISAS; Guangdong Academy of Medical Sciences
Factors influencing trust in medical artificial intelligence for healthcare professionals: a narrative review,"Objective: We performed a comprehensive review of the literature to better understand the trust dynamics between medical artificial intelligence (AI) and healthcare expert end-users. We explored the factors that influence trust in these technologies and how they compare to established concepts of trust in the engineering discipline. By identifying the qualitatively and quantitatively assessed factors that influence trust in medical AI, we gain insight into understanding how autonomous systems can be optimized during the development phase to improve decision-making support and clinician-machine teaming. This facilitates an enhanced understanding of the qualities that healthcare professional users seek in AI to consider it trustworthy. We also highlight key considerations for promoting on-going improvement of trust in autonomous medical systems to support the adoption of medical technologies into practice. Background: Artificially intelligent technology is revolutionizing healthcare. However, lack of trust in the output of such complex decision support systems introduces challenges and barriers to adoption and implementation into clinical practice. Methods: We searched databases including, Ovid MEDLINE, Ovid EMBASE, Clarivate Web of Science, and Google Scholar, as well as gray literature, for publications from 2000 to July 15, 2021, that reported features of AI-based diagnostic and clinical decision support systems that contribute to enhanced end-user trust. Papers discussing implications and applications of medical AI in clinical practice were also recorded. Results were based on the quantity of papers that discussed each trust concept, either quantitatively or qualitatively, using frequency of concept commentary as a proxy for importance of a respective concept. Conclusions: Explainability, transparency, interpretability, usability, and education are among the key identified factors thought to influence a healthcare professionals' trust in medical AI and enhance clinician-machine teaming in critical decision-making healthcare environments. We also identified the need to better evaluate and incorporate other critical factors to promote trust by consulting medical professionals when developing AI systems for clinical decision-making and diagnostic support.",https://openalex.org/W4205278045,2021,Victoria Tucci; Joan Saary; Thomas E. Doyle,McMaster University; Canadian Armed Forces; University of Toronto
