title,abstract,url,publication_year,authors,institutions
"Artificial intelligence enabled healthcare: A hype, hope or harm","In this paper, we have described the health care problem (maldistribution of doctors) in India. Later, we have introduced the concept of artificial intelligence and we have described this technology with various examples, how it is rapidly changing the health care scenario across the world. We have also described the various advantages of artificial intelligence technology. At the end of the paper, we have raised some serious concerns regarding complete replacement of human based health care technology with artificial intelligence technology. Lastly, we concluded that we have to use artificial intelligent technology to prevent human sufferings/health care problems with proper caution.",https://openalex.org/W2989124517,2019,Sudip Bhattacharya; Keerti Bhusan Pradhan; MA Bashar,Chitkara University; Institute of Medical Sciences
Artificial intelligence in healthcare (Review),"The potential of artificial intelligence (AI) to significantly transform numerous aspects of contemporary civilization is substantial. Advancements in research show an increasing interest in creating AI solutions in the healthcare sector. This interest is driven by the broad spectrum and extensive nature of easily accessible patient data-including medical imaging, digitized data collection, and electronic health records - and by the ability to analyze and interpret complex data, facilitating more accurate and timely diagnoses. This review's goal is to provide a comprehensive overview of the advancements achieved by AI in healthcare, to elucidate the present state of AI in enhancing the healthcare system and improving the quality and efficiency of healthcare decision making, and to discuss selected medical applications of AI. Furthermore, the barriers and constraints that may impede the use of AI in healthcare are outlined, and the potential future directions of AI-augmented healthcare systems are discussed.",https://openalex.org/W4404286659,2024,Abdul-Mohsen Alhejaily,King Fahd Medical City
Artificial Intelligence in Healthcare,"Modern technology development created significant innovations in delivery of healthcare. Artificial intelligence as “a branch of computer science dealing with the simulation of intelligent behaviour in computers” when applied in health care resulted in intelligent support to decision-making, optimised business processes, increased quality, monitoring and delivering of personalised treatment plans and many other applications. Even though the benefits are clear and numerous, there are still open issues in creating automation of healthcare processes, ensuring data protection and integrity, reduction of medical waste etc. However, due to rapid development of AI techniques, more advances and improvements are still expected.",https://openalex.org/W3089486490,2020,Ivana Ognjanović,University of Donja Gorica
Applying artificial intelligence in healthcare: lessons from the COVID-19 pandemic,"The COVID-19 pandemic exposed vulnerabilities in global healthcare systems and highlighted the need for innovative, technology-driven solutions like Artificial Intelligence (AI). However, previous research on the topic has been limited and fragmented, leading to an incomplete understanding of the ‘what’, ‘where’ and ‘how’ of its application, as well as its associated benefits and challenges. This study proposes a comprehensive AI framework for healthcare and assesses its effectiveness within the UAE’s healthcare sector. It provides valuable insights into AI applications for healthcare stakeholders that range from the molecular to the population level. The study covers the different computational techniques employed, from machine learning to computer vision, and the various types of data inputs fed into these techniques, including clinical, epidemiological, locational, behavioural and genomic data. Additionally, the research highlights AI’s capacity to enhance healthcare’s operational, quality-related and social outcomes, and recognises regulatory policies, technological infrastructure, stakeholder cooperation and innovation readiness as key facilitators of AI adoption. Lastly, we stress the importance of addressing challenges such as data privacy, security, generalisability and algorithmic bias. Our findings are relevant beyond the pandemic in facilitating the development of AI-related policy interventions and support mechanisms for building resilient healthcare sector that can withstand future challenges.",https://openalex.org/W4387307469,2023,Sreejith Balasubramanian; Vinaya Shukla; Nazrul Islam,Middlesex University Dubai; Middlesex University; University of East London
American public opinion on artificial intelligence in healthcare,"Billions of dollars are being invested into developing medical artificial intelligence (AI) systems and yet public opinion of AI in the medical field seems to be mixed. Although high expectations for the future of medical AI do exist in the American public, anxiety and uncertainty about what it can do and how it works is widespread. Continuing evaluation of public opinion on AI in healthcare is necessary to ensure alignment between patient attitudes and the technologies adopted. We conducted a representative-sample survey (total N = 203) to measure the trust of the American public towards medical AI. Primarily, we contrasted preferences for AI and human professionals to be medical decision-makers. Additionally, we measured expectations for the impact and use of medical AI in the future. We present four noteworthy results: (1) The general public strongly prefers human medical professionals make medical decisions, while at the same time believing they are more likely to make culturally biased decisions than AI. (2) The general public is more comfortable with a human reading their medical records than an AI, both now and “100 years from now.” (3) The general public is nearly evenly split between those who would trust their own doctor to use AI and those who would not. (4) Respondents expect AI will improve medical treatment but more so in the distant future than immediately.",https://openalex.org/W4388540989,2023,J. Rojahn; Andrea Palu; Steven Skiena,Stony Brook University
SHIFTing artificial intelligence to be responsible in healthcare: A systematic review,"A variety of ethical concerns about artificial intelligence (AI) implementation in healthcare have emerged as AI becomes increasingly applicable and technologically advanced. The last decade has witnessed significant endeavors in striking a balance between ethical considerations and health transformation led by AI. Despite a growing interest in AI ethics, implementing AI-related technologies and initiatives responsibly in healthcare settings remains a challenge. In response to this topical challenge, we reviewed 253 articles pertaining to AI ethics in healthcare published between 2000 and 2020, summarizing the coherent themes of responsible AI initiatives. A preferred reporting items for systematic review and meta-analysis (PRISMA) approach was employed to screen and select articles, and a hermeneutic approach was adopted to conduct systematic literature review. By synthesizing relevant knowledge from AI governance and ethics, we propose a responsible AI initiative framework that encompasses five core themes for AI solution developers, healthcare professionals, and policy makers. These themes are summarized in the acronym SHIFT: Sustainability, Human centeredness, Inclusiveness, Fairness, and Transparency. In addition, we unravel the key issues and challenges concerning responsible AI use in healthcare, and outline avenues for future research.",https://openalex.org/W4210605645,2022,Haytham Siala; Yichuan Wang,Middlesex University; Newcastle University; University of Sheffield
"A survey of explainable artificial intelligence in healthcare: Concepts, applications, and challenges","Explainable AI (XAI) has the potential to transform healthcare by making AI-driven medical decisions more transparent, reliable, and ethically compliant. Despite its promise, the healthcare sector faces several challenges, including the need to balance interpretability and accuracy, integrating XAI into clinical workflows, and ensuring adherence to rigorous regulatory standards. This paper provides a comprehensive review of XAI in healthcare, covering techniques, challenges, opportunities, and advancements, thereby enhancing the understanding and practical application of XAI in healthcare. The study also explores responsible AI in healthcare, discussing new perspectives and emerging trends, offering valuable insights for researchers and practitioners. The insights and recommendations presented aim to guide future research and policy-making, fostering the development of transparent, trustworthy, and effective AI-driven solutions.",https://openalex.org/W4403457107,2024,Ibomoiye Domor Mienye; George Obaido; Nobert Jere,
Implementing the human right to science in the regulatory governance of artificial intelligence in healthcare,"Abstract Artificial intelligence (AI) enables a medical device to optimize its performance through machine learning (ML), including the ability to learn from past experiences. In healthcare, ML is currently applied within controlled settings in devices to diagnose conditions like diabetic retinopathy without clinician input, for instance. In order to allow AI-based medical devices (AIMDs) to adapt actively to its data environment through ML, the current risk-based regulatory approaches are inadequate in facilitating this technological progression. Recent and innovative regulatory changes introduced to regulate AIMDs as a software, or ‘software as a medical device’ (SaMD), and the adoption of a total device/product-specific lifecycle approach (rather than one that is point-in-time) reflect a shift away from the strictly risk-based approach to one that is more collaborative and participatory in nature, and anticipatory in character. These features are better explained by a rights-based approach and consistent with the human right to science (HRS). With reference to the recent explication of the normative content of HRS by the Committee on Economic, Social and Cultural Rights of the United Nations, this paper explains why a rights-based approach that is centred on HRS could be a more effective response to the regulatory challenges posed by AIMDs. The paper also considers how such a rights-based approach could be implemented in the form of a regulatory network that draws on a ‘common fund of knowledges’ to formulate anticipatory responses to adaptive AIMDs. In essence, the HRS provides both the mandate and the obligation for states to ensure that regulatory governance of high connectivity AIMDs become increasingly collaborative and participatory in approach and pluralistic in substance.",https://openalex.org/W4387731794,2023,Calvin Wai-Loon Ho,University of Hong Kong
The Emerging Role of Artificial Intelligence in Healthcare,"Artificial intelligence (AI) is increasingly being used in the field of healthcare to improve the efficiency and accuracy of medical diagnoses, treatment plans, and decisionmaking.1 It has the potential to transform the way healthcare is delivered and improve patient outcomes. There are many examples of the use of artificial intelligence (AI) in healthcare. One way that AI is being used in healthcare is by developing machine learning algorithms that can analyze vast amounts of patient data and identify patterns and trends that may not be immediately apparent to humans.2 This can be particularly useful in identifying early signs of diseases or conditions, allowing for earlier diagnosis, treatment, prognosis evaluation, and more. Another application of AI in healthcare is through the use of natural language processing (NLP). NLP systems can analyze electronic medical records (EMR) and extract important information, allowing healthcare providers to access and interpret patient data conveniently.3 This can help healthcare providers access and interpret patient data more easily, leading to more informed decision-making and better patient care. AI can also be used to assist with tasks such as image analysis, allowing for more accurate analysis and efficient diagnosis of medical images such as CT scans or X-rays.4 In addition, AI can be used to help automate routine tasks, freeing up healthcare providers to focus on more complex and higher-level tasks that require human expertise.5 Machine learning algorithms can analyze large amounts of patient data and identify patterns and trends that may not be immediately apparent to humans.6 This can be useful in identifying early signs of diseases or conditions, leading to earlier diagnosis and treatment. AI-powered chatbots or virtual assistants can help with tasks such as appointment scheduling and medication reminders.7 Systems that can assist with the automation of routine tasks, freeing up healthcare providers to focus on more complex and higher-level tasks that require human expertise. Predictive analytics systems can forecast patient outcomes and help healthcare providers make informed decisions about treatment plans.8 Personalized medicine systems can help tailor treatment plans to individual patients based on their specific needs and characteristics. These are just a few examples of the many ways in which AI is being used in healthcare. It is important to note that AI in healthcare is still in its early stages, and the potential applications of the technology are likely to expand significantly in the coming years.",https://openalex.org/W4381952038,2023,Farooq Azam Rathore; Muhammad Ahmad Rathore,Armed Forces Institute of Pathology; Northwestern University
Breaking Barriers: Unveiling Factors Influencing the Adoption of Artificial Intelligence by Healthcare Providers,"Artificial intelligence (AI) is an emerging technological system that provides a platform to manage and analyze data by emulating human cognitive functions with greater accuracy, revolutionizing patient care and introducing a paradigm shift to the healthcare industry. The purpose of this study is to identify the underlying factors that affect the adoption of artificial intelligence in healthcare (AIH) by healthcare providers and to understand “What are the factors that influence healthcare providers’ behavioral intentions to adopt AIH in their routine practice?” An integrated survey was conducted among healthcare providers, including consultants, residents/students, and nurses. The survey included items related to performance expectancy, effort expectancy, initial trust, personal innovativeness, task complexity, and technology characteristics. The collected data were analyzed using structural equation modeling. A total of 392 healthcare professionals participated in the survey, with 72.4% being male and 50.7% being 30 years old or younger. The results showed that performance expectancy, effort expectancy, and initial trust have a positive influence on the behavioral intentions of healthcare providers to use AIH. Personal innovativeness was found to have a positive influence on effort expectancy, while task complexity and technology characteristics have a positive influence on effort expectancy for AIH. The study’s empirically validated model sheds light on healthcare providers’ intention to adopt AIH, while the study’s findings can be used to develop strategies to encourage this adoption. However, further investigation is necessary to understand the individual factors affecting the adoption of AIH by healthcare providers.",https://openalex.org/W4378878754,2023,B. M. Zeeshan Hameed; Nithesh Naik; Sufyan Ibrahim,Father Muller Medical College Hospital; Manipal Academy of Higher Education; Mayo Clinic in Florida
Evolution of artificial intelligence in healthcare: a 30-year bibliometric study,"Introduction In recent years, the development of artificial intelligence (AI) technologies, including machine learning, deep learning, and large language models, has significantly supported clinical work. Concurrently, the integration of artificial intelligence with the medical field has garnered increasing attention from medical experts. This study undertakes a dynamic and longitudinal bibliometric analysis of AI publications within the healthcare sector over the past three decades to investigate the current status and trends of the fusion between medicine and artificial intelligence. Methods Following a search on the Web of Science, researchers retrieved all reviews and original articles concerning artificial intelligence in healthcare published between January 1993 and December 2023. The analysis employed Bibliometrix, Biblioshiny, and Microsoft Excel, incorporating the bibliometrix R package for data mining and analysis, and visualized the observed trends in bibliometrics. Results A total of 22,950 documents were collected in this study. From 1993 to 2023, there was a discernible upward trajectory in scientific output within bibliometrics. The United States and China emerged as primary contributors to medical artificial intelligence research, with Harvard University leading in publication volume among institutions. Notably, the rapid expansion of emerging topics such as COVID-19 and new drug discovery in recent years is noteworthy. Furthermore, the top five most cited papers in 2023 were all pertinent to the theme of ChatGPT. Conclusion This study reveals a sustained explosive growth trend in AI technologies within the healthcare sector in recent years, with increasingly profound applications in medicine. Additionally, medical artificial intelligence research is dynamically evolving with the advent of new technologies. Moving forward, concerted efforts to bolster international collaboration and enhance comprehension and utilization of AI technologies are imperative for fostering novel innovations in healthcare.",https://openalex.org/W4406406220,2025,Yiweng Xie; Yuansheng Zhai; Guihua Lu,"Sun Yat-sen University; The First Affiliated Hospital, Sun Yat-sen University"
Artificial Intelligence in Healthcare,The healthcare sector has seen rapid changes with several medical devices doctors use to interact with patients. Big data is generated by medical gadgets to help track the patient's physical and mental condition. The use of artificial intelligence help get the descriptive and predictive health information of the patient that is useful for medical service providers and insurance companies. The rise of the computational power of the device has made artificial intelligence technology more effective and helped make optimal decisions.,https://openalex.org/W2990305329,2021,Ajay Kumar Yadav; Rajesh Mamilla,
Sources of bias in artificial intelligence that perpetuate healthcare disparities—A global review,"Background While artificial intelligence (AI) offers possibilities of advanced clinical prediction and decision-making in healthcare, models trained on relatively homogeneous datasets, and populations poorly-representative of underlying diversity, limits generalisability and risks biased AI-based decisions. Here, we describe the landscape of AI in clinical medicine to delineate population and data-source disparities. Methods We performed a scoping review of clinical papers published in PubMed in 2019 using AI techniques. We assessed differences in dataset country source, clinical specialty, and author nationality, sex, and expertise. A manually tagged subsample of PubMed articles was used to train a model, leveraging transfer-learning techniques (building upon an existing BioBERT model) to predict eligibility for inclusion (original, human, clinical AI literature). Of all eligible articles, database country source and clinical specialty were manually labelled. A BioBERT-based model predicted first/last author expertise. Author nationality was determined using corresponding affiliated institution information using Entrez Direct. And first/last author sex was evaluated using the Gendarize.io API. Results Our search yielded 30,576 articles, of which 7,314 (23.9%) were eligible for further analysis. Most databases came from the US (40.8%) and China (13.7%). Radiology was the most represented clinical specialty (40.4%), followed by pathology (9.1%). Authors were primarily from either China (24.0%) or the US (18.4%). First and last authors were predominately data experts (i.e., statisticians) (59.6% and 53.9% respectively) rather than clinicians. And the majority of first/last authors were male (74.1%). Interpretation U.S. and Chinese datasets and authors were disproportionately overrepresented in clinical AI, and almost all of the top 10 databases and author nationalities were from high income countries (HICs). AI techniques were most commonly employed for image-rich specialties, and authors were predominantly male, with non-clinical backgrounds. Development of technological infrastructure in data-poor regions, and diligence in external validation and model re-calibration prior to clinical implementation in the short-term, are crucial in ensuring clinical AI is meaningful for broader populations, and to avoid perpetuating global health inequity.",https://openalex.org/W4220839569,2022,Leo Anthony Celi; Jacqueline Cellini; Marie‐Laure Charpignon,Beth Israel Deaconess Medical Center; Harvard University; Massachusetts Institute of Technology
Applications of Artificial Intelligence (AI) in healthcare: A review,"Artificial intelligence is revolutionizing — and strengthening — modern healthcare through technologies that can predict, grasp, learn, and act, whether it's employed to identify new relationships between genetic codes or to control surgery-assisting robots. It can detect minor patterns that humans would completely overlook. This study explores and discusses the various modern applications of AI in the health sector. Particularly, the study focuses on three most emerging areas of AI-powered healthcare: AI-led drug discovery, clinical trials, and patient care. The findings suggest that pharmaceutical firms have benefited from AI in healthcare by speeding up their drug discovery process and automating target identification. Artificial Intelligence (AI) can help also to eliminate time-consuming data monitoring methods. The findings also indicate that AI-assisted clinical trials are capable of handling massive volumes of data and producing highly accurate results. Medical AI companies develop systems that assist patients at every level. Patients' medical data is also analyzed by clinical intelligence, which provides insights to assist them improve their quality of life.",https://openalex.org/W3202819594,2021,Mohammed Yousef Shaheen,
Artificial Intelligence in Healthcare,"This chapter critically examines the claim that “healthcare independence relies on total dependence on artificial intelligence” in the context of the integration of AI in healthcare. It explores the role of AI in improving diagnostic accuracy, treatment planning, and operational efficiency. However, it also acknowledges the limitations and ethical considerations associated with AI, such as algorithmic biases and patient privacy concerns. The chapter emphasizes the importance of maintaining a patient-centric approach and preserving the human element in healthcare, with AI serving as a supportive tool rather than a replacement for human expertise. Interdisciplinary collaboration is highlighted as crucial in fully harnessing AI's potential in healthcare. Overall, the chapter provides a nuanced perspective on the transformative potential of AI in achieving healthcare independence while acknowledging the need for responsible and ethical AI implementation.",https://openalex.org/W4388782329,2023,C. V. Suresh Babu; N. S. Akshayah; P. Maclin Vinola,Hindustan Institute of Technology and Science
Use of Artificial Intelligence in Healthcare and Medicine,"Artificial Intelligence is a field of computer science that mimic human cognitive functions. It has brought a paradigm shift in the medical field mostly due to the increase in healthcare data and rapid increase of analytical techniques. In recent years AI has surpassed human performance in several medical field areas, and this is a great adoption in healthcare. Also, through the use of analytical techniques, AI has the capabilities to prevent, detect, diagnose, and treat a wide range of diseases. This research paper will discuss different types of Artificial Intelligence techniques and how AI has been used in healthcare. Also, it will provide a view of the future of Artificial Intelligence in healthcare.",https://openalex.org/W3039631210,2020,Deekshaa Khanna,Barkatullah University
