title,abstract,url,publication_year,authors,institutions
Digital Twin Shop-Floor: A New Shop-Floor Paradigm Towards Smart Manufacturing,"With the developments and applications of the new information technologies, such as cloud computing, Internet of Things, big data, and artificial intelligence, a smart manufacturing era is coming. At the same time, various national manufacturing development strategies have been put forward, such as Industry 4.0, Industrial Internet, manufacturing based on Cyber-Physical System, and Made in China 2025. However, one of specific challenges to achieve smart manufacturing with these strategies is how to converge the manufacturing physical world and the virtual world, so as to realize a series of smart operations in the manufacturing process, including smart interconnection, smart interaction, smart control and management, etc. In this context, as a basic unit of manufacturing, shop-floor is required to reach the interaction and convergence between physical and virtual spaces, which is not only the imperative demand of smart manufacturing, but also the evolving trend of itself. Accordingly, a novel concept of digital twin shopfloor (DTS) based on digital twin is explored and its four key components are discussed, including physical shop-floor, virtual shop-floor, shop-floor service system, and shop-floor digital twin data. What is more, the operation mechanisms and implementing methods for DTS are studied and key technologies as well as challenges ahead are investigated, respectively.",https://openalex.org/W2757110387,2017,Fei Tao; Meng Zhang,Beihang University; ORCID
"Rationality, foolishness, and adaptive intelligence","Abstract Technologies of model‐based rationality are the core technologies of strategic management, having largely replaced earlier technologies that placed greater reliance on traditional practice or on communication either with the stars or with the gods. The technologies used by organizations in their pursuit of intelligence can be imagined to change over time as a result of responding to the successes and failures associated with the technologies. Although technologies of rationality seem clearly to be effective instruments of exploitation in relatively simple situations and to derive their adaptive advantage from those capabilities, their ventures in more complex explorations seem often to lead to huge mistakes and thus unlikely to be sustained by adaptive processes. Whether their survival as instruments of exploratory novelty in complex situations is desirable is a difficult question to answer, but it seems likely that any such survival may require hitchhiking on their successes in simpler worlds. Survival may also be served by the heroism of fools and the blindness of true believers. Their imperviousness to feedback is both the despair of adaptive intelligence and, conceivably, its salvation. Copyright © 2006 John Wiley &amp; Sons, Ltd.",https://openalex.org/W2033070529,2006,James G. March,Stanford University
Applications of Artificial Intelligence and Blockchain Technology in Improved Supply Chain Financial Risk Management,"With greater frequency and granularity than ever before, artificial intelligence (AI) and blockchain technology can help businesses achieve next-level performance in the supply chain. Blockchain can reliably construct the framework for recording data across endpoints, whereas AI can assist in data matching. This study investigates how to apply blockchain technology and artificial intelligence together in supply chains to push the boundaries of operational effectiveness, promote sustainable growth, and monetize data. This study has examined how blockchain can be used to track financial operations in the supply chain and also aims to determine how artificial intelligence contributes to supply chain management. The study's anticipated results will increase knowledge of blockchain technology and artificial intelligence in supply chain risk management and encourage practitioners and researchers to think about using these technologies in future context-aware research.",https://openalex.org/W4360585324,2022,K. Nethravathi; Ankit Tiwari; Dipesh Uike,Jain University; Graphic Era University; IMS Unison University
Technology in tourism-from information communication technologies to eTourism and smart tourism towards ambient intelligence tourism: a perspective article,"Purpose Technology revolutionises the tourism industry and determines the strategy and competitiveness of tourism organisations and destinations. This paper aims to explore the transformational and disruptive nature of technology for tourism. Design/methodology/approach This paper is based on systematic research. Findings Technology innovations bring the entire range of stakeholders together in tourism service ecosystems. Technology-empowered tourism experiences increasingly support travellers to co-create value throughout all stages of travel. Ambient Intelligence (AmI) Tourism (2020-future) is driven by a range of disruptive technologies. Inevitably smart environments transform industry structures, processes and practices, having disruptive impacts for service innovation, strategy, management, marketing and competitiveness of everybody involved. Originality/value The paper synthesises developments in technology for tourism and proposes a future perspective.",https://openalex.org/W2973831713,2019,Dimitrios Buhalis,Bournemouth University
"Artificial intelligence in open innovation project management: A systematic literature review on technologies, applications, and integration requirements","This study aims to provide insights to support organizations in building effective strategies for adopting Artificial Intelligence (AI) and improving project management processes. It focuses on open innovation projects. It employs a comprehensive and systematic literature review (SLR). A total of 365 publications have been chosen from a pool of 1265 papers in the IEEE and Scopus databases. The study develops a framework for literature synthesis guided by five research questions. Those questions address AI technologies, project management tasks, industries adopting AI, and requirements for successful adoption. The analysis reveals that Machine Learning is widely employed in project management, especially for predicting analytics, optimizing resources, and managing risks. AI improves open innovation project management by integrating diverse knowledge sources, enhancing collaboration, and providing strategic insights for decision-making. This study also found that AI adoption depends not only on technical infrastructure, integration with existing systems, and data readiness but also on leadership support, strategic alignment, financial resources, skills development, and organizational culture. The findings also highlight the importance of aligning AI initiatives with open innovation requirements, where collaboration, agility, and external knowledge integrations are crucial. The construction sector is at the forefront of adopting AI. This study fills a significant gap in previous research by identifying the technical and non-technical prerequisites for effectively incorporating AI into open innovation project management methodologies.",https://openalex.org/W4404886041,2024,Moonita Limiany Prasetyo; Rosliyana Perangin-Angin; Nada Martinovic,
"Database Systems: A Practical Approach to Design, Implementation and Management","This best-selling text introduces the theory behind databases in a concise yet comprehensive manner, providing database design methodology that can be used by both technical and non-technical readers. The methodology for relational Database Management Systems is presented in simple, step-by-step instructions in conjunction with a realistic worked example using three explicit phasesconceptual, logical, and physical database design. Background: Introduction to Databases; Database Environment; Database Architectures and the Web. The Relational Model and Languages: The Relational model; Relational Algebra and Relational Calculus; SQL: Data Manipulation; SQL: Data Definition; Query-By-Example (QBE). Database Analysis and Design: Database System Lifecycle; Database Analysis and the DreamHome Case Study; EntityRelationship Modeling; Enhanced EntityRelationship Modeling; Normalization; Advanced Normalization. Methodology: MethodologyConceptual Database Design; MethodologyLogical Database Design for Relational Model; MethodologyPhysical Database Design for Relational Databases; MethodologyMonitoring and Tuning the Operational System. Selected Database Issues: Security and Administration; Professional, Legal, and Ethical Issues; Transaction Management; Query Processing. Distributed DBMSs and Replication: Distributed DBMSsConcepts and Design; Distributed DBMSsAdvanced Concepts; Replication and Mobile Databases. Object DBMSs: Object-Oriented DBMSsConcepts and Design; Object-Oriented DBMSsStandards and Languages; Object-Relational DBMSs. Web and DBMSs: Web Technology and DBMSs; Semistructured Data and XML. Business Intelligence Technologies: Data Warehousing Concepts; Data Warehousing Design; OLAP; Data Mining. Appendices: Users' Requirements Specification for DreamHome Case Study; Other Case Studies; Alternative Data Modeling Notations; Summary of the Database Design Methodology for Relational Databases; Introduction to PyrrhoA Liteweight RDBMS. Web Appendices: File Organization and Storage Structures; When Is a DBMS Relational?; Commercial DBMSs: Access and Oracle; Programmatic SQL; Estimating Disk Space Requirements; Introduction to Object-Orientation; Example Web Scripts. This book is ideal for readers interested in database management or database design.",https://openalex.org/W1575391024,1998,Thomas Connolly; Carolyn E. Begg,
Research on the Application of Artificial Intelligence Technology in Human Resource Management,"Machines have gradually replaced low-skilled, low-wage, and high-repetition jobs since the industrial revolution.Some smart devices were hidden behind the scenes in the past; artificial intelligence is getting more and more attention with the advent of technology.Many workplaces have been reshaped in the era of artificial intelligence, work patterns have been changed, many jobs have been redefined, and so has the work of human resources management.In the future, a lot of work in human resources management may be replaced by artificial intelligence.But what needs to be done in the future is more judgment work than repetitive work.Human resource practitioners will not disappear, but the work content will change from low-value and repetitive work to planning, judging, organizing strategies, and emotional input.This paper mainly studies the influence of artificial intelligence technology on the six modules of human resource management and the concrete application of artificial intelligence technology in human resource management.",https://openalex.org/W2912787662,2018,Fengxiang Jiang; Jie Li; Moutao Du,Xi'an Peihua University
The Application of Big Data and Artificial Intelligence Technology in Enterprise Information Security Management and Risk Assessment,"With the development of digitalization and Internet technology, enterprise information security is facing more and more challenges. Many enterprises have begun to adopt big data (BD) and artificial intelligence (AI) technology for risk assessment (RA) and prediction to effectively manage information security risks. This article discusses the application of BD and AI technology in enterprise information security management (ISM) and RA from two aspects. Firstly, the mobile payment signature scheme based on number theory research unit is used to improve the security of the mobile payment system. This scheme uses lattice algorithms to achieve fast key generation, signing, and verification and can resist traditional cryptographic attacks. Secondly, a set of enterprise ISM and RA system is established, including risk identification, RA, monitoring and early warning, emergency response, and other links. BD and AI technology is used to analyze internal and external data to provide accurate RA results to achieve automated RA.",https://openalex.org/W4385342341,2023,Qi Wang; Bangfeng Zong; Yuanxiang Lin,Hefei University of Technology; Suzhou University of Science and Technology
"Artificial intelligence and innovation management: A review, framework, and research agenda✰","Artificial Intelligence (AI) reshapes companies and how innovation management is organized. Consistent with rapid technological development and the replacement of human organization, AI may indeed compel management to rethink a company's entire innovation process. In response, we review and explore the implications for future innovation management. Using ideas from the Carnegie School and the behavioral theory of the firm, we review the implications for innovation management of AI technologies and machine learning-based AI systems. We outline a framework showing the extent to which AI can replace humans and explain what is important to consider in making the transformation to the digital organization of innovation. We conclude our study by exploring directions for future research.",https://openalex.org/W3093821457,2020,Naomi Haefner; Joakim Wincent; Vinit Parida,University of St.Gallen; Hanken School of Economics; University of Vaasa
Construction and Path of Urban Public Safety Governance and Crisis Management Optimization Model Integrating Artificial Intelligence Technology,"As urbanization and population growth continue to accelerate in China, maintaining public safety and crisis management has become increasingly complex. To address this issue, this research article proposes a new model for optimizing urban public safety governance and crisis management by integrating artificial intelligence (AI) technology with a focus on sustainability. This study aims to explore the construction and path of an urban public safety governance and crisis management optimization model integrating artificial intelligence (AI) technology in China. We developed a linear regression model to examine the relationship between public safety technologies and outcomes, with public safety outcomes (PSO) as the dependent variable and public safety governance structure (PSGS), AI-driven data collection and analysis (AIDC&amp;A), crisis prediction and early warning system (CPEWS), AI-assisted decision-making (AIADM), and public safety response mechanisms (PSRM) as independent variables. The model summary revealed that the independent variables accounted for a moderate proportion of the variance in public safety outcomes, with an R² value of 0.5 and an adjusted R² value of 0.45. The results supported the hypothesis that the integration of different public safety technologies has a positive impact on public safety outcomes. The effective governance structure, AI-driven data collection and analysis, crisis prediction and early warning system, AI-assisted decision-making, and efficient public safety response mechanisms were all found to be crucial for enhancing public safety outcomes. The proposed model was validated through a case study in a Chinese city, with feedback from stakeholders confirming its effectiveness. Overall, the findings suggest that the urban public safety governance and crisis management optimization model integrating AI technology can significantly improve public safety management in urban areas.",https://openalex.org/W4368404577,2023,Guo Li; Jinfeng Wang; Xin Wang,Zhengzhou University; Shanghai Maritime University
Security and Immigration: Toward a Critique of the Governmentality of Unease,"Migration is increasingly interpreted as a security problem. The prism of security analysis is especially important for politicians, for national and local police organizations, the military police, customs officers, border patrols, secret services, armies, judges, some social services (health care, hospitals, schools), private corporations (bank analysts, providers of technology surveillance, private policing), many journalists (especially from television and the more sensationalist newspapers), and a significant fraction of general public opinion, especially but not only among those attracted to law and order. The popularity of this security prism is not an expression of traditional responses to a rise of insecurity, crime, terrorism, and the negative effects of globalization; it is the result of the creation of a continuum of threats and general unease in which many different actors exchange their fears and beliefs in the process of making a risky and dangerous society. The professionals in charge of the management of risk and fear especially transfer the legitimacy they gain from struggles against terrorists, criminals, spies, and counterfeiters toward other targets, most notably transnational political activists, people crossing borders, or people born in the country but with foreign parents. This expansion of what security is taken to include effectively results in a convergence between the meaning of international and internal security. The convergence is particularly important in relation to the issue of migration, and specifically in relation to questions about who gets to be defined as an immigrant. The security professionals themselves, along with some academics, tend to claim that they are only responding to new threats requiring exceptional measures beyond the normal demands of everyday politics. In practice, however, the transformation of security and the consequent focus on immigrants is directly related to their own immediate interests (competition for budgets and missions) and to the transformation of technologies they use (computerized databanks, profiling and morphing, electronic phone tapping). The Europeanization and the Westernization of the logics of control and surveillance of people beyond national polices is driven by the creation of a transnational field of professionals in the management of unease. This field is larger than that of police organizations in that it includes, on one hand private corporations and organizations dealing with the control of access to the welfare state, and, on the other hand, intelligence services and some military people seeking a new role after the end of the Cold War. These professionals in the management of unease, however, are only a node connecting many competing networks responding to many groups of people who are identified as risk or just as a source of unease. (1) This process of securitization is now well known, but despite the many discourses that have drawn attention to the securitization of migration over the past ten years, the articulation of migration as a security problem continues. Why? What are the reasons of the persistent framing of migration in relation to terrorism, crime, unemployment and religious zealotry, on the one hand, and to integration, interest of the migrant for the national economy development, on the other, rather than in relation to new opportunities for European societies, for freedom of travel over the world, for cosmopolitanism, or for some new understanding of citizenship? (2) This is the question I want to address in this essay. Some critical discourses generated by NGOs and academics assume that if people, politicians, governments, bureaucracies, and journalists were more aware, they would change their minds about migration and begin to resist securitizing it. The primary problem, therefore, is ideological or discursive in that the securitization of migrants derives from the language itself and from the different capacities of various actors to engage in speech acts. …",https://openalex.org/W2104983586,2002,Didier Bigo,
Optimizing Facilities Management Through Artificial Intelligence and Digital Twin Technology in Mega-Facilities,"Mega-facility management has long been inefficient due to manual, reactive approaches. Current facility management systems face challenges such as fragmented data integration, limited predictive systems, use of traditional methods, and lack of knowledge of new technologies, such as Building Information Modeling and Artificial Intelligence. This study examines the transformative integration of Artificial Intelligence and Digital Twin technologies into Building Information Modeling (BIM) frameworks using IoT sensors for real-time data collection and predictive analytics. Unlike previous research, this study uses case studies and simulation models for dynamic data integration and scenario-based analyses. Key findings show a significant reduction in maintenance costs (25%) and energy consumption (20%), as well as increased asset utilization and operational efficiency. With an F1-score of more than 90%, the system shows excellent predictive accuracy for equipment failures and energy forecasting. Practical applications in hospitals and airports demonstrate the developed ability of the platform to integrate the Internet of Things and Building Information Modeling technologies, shifting facilities management from being reactive to proactive. This paper presents a demo platform that integrates BIM with Digital Twins to improve the predictive maintenance of HVAC systems, equipment, security systems, etc., by recording data from different assets, which helps streamline asset management, enhance energy efficiency, and support decision-making for the buildings’ critical systems.",https://openalex.org/W4407809132,2025,Ahmed Mohammed Abdelalim; Ahmed Essawy; Алаа Шериф,Helwan University
"Performance Dashboards: Measuring, Monitoring, and Managing Your Business","""Tips, techniques, and trends on harnessing dashboard technology to optimize business performance In Performance Dashboards, Second Edition, author Wayne Eckerson explains what dashboards are, where they can be used, and why they are important to measuring and managing performance. As Director of Research for The Data Warehousing Institute, a worldwide association of business intelligence professionals, Eckerson interviewed dozens of organizations that have built various types of performance dashboards in different industries and lines of business. Their practical insights explore how you can effectively turbo-charge performance-management initiatives with dashboard technology. Includes all-new case studies, industry research, news chapters on ""Architecting Performance Dashboards"" and ""Launching and Managing the Project"" and updated information on designing KPIs, designing dashboard displays, integrating dashboards, and types of dashboards. Provides a solid foundation for understanding performance dashboards, business intelligence, and performance management. Addresses the next generation of performance dashboards, such as Mashboards and Visual Discovery tools, and including new techniques for designing dashboards and developing key performance indicators. Offers guidance on how to incorporate predictive analytics, what-if modeling, collaboration, and advanced visualization techniques. This updated book, which is 75% rewritten, provides a foundation for understanding performance dashboards, business intelligence, and performance management to optimize performance and accelerate results.""--Provided by publisher",https://openalex.org/W2498905566,2005,Wayne W. Eckerson,
Warehouse Management Models Using Artificial Intelligence Technology with Application at Receiving Stage – A Review,"This paper reviewed recent literature on inventory management technologies and Artificial Intelligence (AI) applications. The classical Artificial Neural Network (ANN) models and computer vision technology applications for object classification were reviewed in particularly. The challenges of AI technologies in industrial warehouse management, particularly the ANN for solving object classification and counting are discussed. Some researchers reported the use of face recognition, moving vehicle classification and counting, which are easy to recognise objects on the floor or the ground. Other researchers explored the object counting technologies which are used to identify the visible objects on the ground or in images. Although several studies focused on industrial component identification and counting problems, a study on the warehouse receiving stage remains a blank canvas. This paper reviews and analyses current industrial warehouse management developments around AI applications in this field, which may provide a reference for future researchers and end-users for the best modelling approach to this specific problem at the warehouse receiving stage.",https://openalex.org/W3167776387,2021,Judy X Yang; Lily D. Li; M.G. Rasul,Central Queensland University; Henan Agricultural University
