title,abstract,url,publication_year,authors,institutions
"Methods and applications for Artificial Intelligence, Big Data, Internet of Things, and Blockchain in smart energy management","Information technologies involving artificial Intelligence, big data, Internet of Things devices and blockchain have been developed and implemented in many engineering fields worldwide. Existing review articles focus on developments and characteristics of individual topics and the associated deployment in the energy sector. These technologies, all based on communication, information, and data analysis, are naturally coherent and integrable. This article reviews the literature and patents in four closely related fields and aims to provide a holistic view of how they are related and their integrability in relation to smart energy management strategies. Artificial intelligence models forecast energy use and load profiles as well as schedule resources to ensure reliable performance and effective utilization of energy resources. Training artificial intelligence models requires immense volumes of data. Utilizing big data systems and data mining enables the discovery of new functions and relationships, which determines the performance of artificial intelligence. Data mining also refines the information; thus, artificial intelligence is trained iteratively with more accurate data. Smart energy management can be further enhanced through advanced digital technologies like Internet of Things and blockchain. An Internet of Things platform containing edge, fog and cloud layers helps connect artificial intelligence to other hardware and software devices and systems. Furthermore, an Internet of Things platform efficiently transmits and stores data, improving access and availability to stakeholders for data mining. Emerging technologies such as blockchain and cryptocurrency facilitate energy trading and can be designed in the cloud layer of an Internet of Things platform to supplement data storage. Providing an efficient and seamless integration of artificial intelligence, big data, and advanced digital technologies will be an important factor in the emerging transition of the energy sector to a lower-carbon system.",https://openalex.org/W4300982014,2022,Joey H. Li; Münür Sacit Herdem; Jatin Nathwani,University of Waterloo; Adıyaman University
SHIMMER™ – A Wireless Sensor Platform for Noninvasive Biomedical Research,"Applying new sensing technology to healthcare maybe part of a solution to the financial and demographic crisis facing global healthcare systems. Researchers applying new approaches to noninvasive patient monitoring and diagnostics are assisted by the features of Sensing Health with Intelligence, Modularity, Mobility and Experimental Reusability (SHIMMER™), a flexible sensing platform. Integrated peripherals, open software, modular expansion, specific power management hardware, and a library of applications supported with platform validation provide SHIMMER with advantages over many other medical research platforms.",https://openalex.org/W2149354205,2010,Adrian Burns; Barry R. Greene; Michael J. McGrath,Intel (Ireland)
ChatGPT - Reshaping medical education and clinical management,"Artificial Intelligence is no more the talk of the fiction read in novels or seen in movies. It has been making inroads slowly and gradually in medical education and clinical management of patients apart from all other walks of life. Recently, chatbots particularly ChatGPT, were developed and trained, using a huge amount of textual data from the internet. This has made a significant impact on our approach in medical science. Though there are benefits of this new technology, a lot of caution is required for its use.&#x0D; doi: https://doi.org/10.12669/pjms.39.2.7653&#x0D; How to cite this: Khan RA, Jawaid M, Khan AR, Sajjad M. ChatGPT - Reshaping medical education and clinical management. Pak J Med Sci. 2023;39(2):---------. doi: https://doi.org/10.12669/pjms.39.2.7653&#x0D; This is an Open Access article distributed under the terms of the Creative Commons Attribution License (http://creativecommons.org/licenses/by/3.0), which permits unrestricted use, distribution, and reproduction in any medium, provided the original work is properly cited.",https://openalex.org/W4319350602,2023,Rehan Ahmed Khan; Masood Jawaid; Aymen Rehan Khan,Riphah International University; Foundation University Medical College
Wearables in Medicine,"Abstract Wearables as medical technologies are becoming an integral part of personal analytics, measuring physical status, recording physiological parameters, or informing schedule for medication. These continuously evolving technology platforms do not only promise to help people pursue a healthier life style, but also provide continuous medical data for actively tracking metabolic status, diagnosis, and treatment. Advances in the miniaturization of flexible electronics, electrochemical biosensors, microfluidics, and artificial intelligence algorithms have led to wearable devices that can generate real‐time medical data within the Internet of things. These flexible devices can be configured to make conformal contact with epidermal, ocular, intracochlear, and dental interfaces to collect biochemical or electrophysiological signals. This article discusses consumer trends in wearable electronics, commercial and emerging devices, and fabrication methods. It also reviews real‐time monitoring of vital signs using biosensors, stimuli‐responsive materials for drug delivery, and closed‐loop theranostic systems. It covers future challenges in augmented, virtual, and mixed reality, communication modes, energy management, displays, conformity, and data safety. The development of patient‐oriented wearable technologies and their incorporation in randomized clinical trials will facilitate the design of safe and effective approaches.",https://openalex.org/W2808514730,2018,Ali K. Yetisen; J. L. Martínez-Hurtado; Barış Ünal,Technical University of Munich; University of Birmingham; Triton Systems (United States)
Does disruptive technology and AI (Artificial Intelligence) influence logistics management?,"Disruptive technologies like AI, automation, and IoT are transforming logistics and distribution management, driving efficiency, cost savings, and improved customer experiences. This empirical investigation investigates the role of these technologies in optimizing operations, enhancing decision-making, and building resilient supply chains. The study analyzes the impact of disruptive technologies on various aspects of logistics, including inventory management, route optimization, predictive maintenance, and last-mile delivery. By leveraging real-time data and advanced analytics, AI algorithms enable accurate demand forecasting, automated replenishment systems, and personalized delivery options, leading to increased efficiency and customer satisfaction. The integration of IoT sensors facilitates real-time tracking of shipments and environmental conditions, enhancing visibility and enabling proactive issue resolution. However, ethical considerations surrounding AI, workforce transformation, and cybersecurity pose challenges that require careful navigation. Study survey was conducted among 216 people from logistics and distribution sector to know “role of disruptive technology and artificial intelligence in effective logistics and distribution management.” The study concludes that there is a significant impact of disruptive technology and artificial intelligence on logistics and distribution management.",https://openalex.org/W4400347547,2024,Indradevi Ramasamy; Sathya Natarajan; Vinod Kumar P. Sathyamoorthy,
Artificial Intelligence Technologies Applied to Smart Grids and Management,"Smart grids represent the evolution of traditional electrical grids through the integration of digital and communication technologies. These grids are capable of monitoring and managing the distribution of electricity efficiently and resiliently. Artificial Intelligence (AI) plays a crucial role in this context, offering advanced solutions for optimization, forecasting, and energy management. This paper explores the main AI technologies applied to smart grids, highlighting their advantages, challenges, and impacts on energy efficiency and sustainability. The methodology employed includes a comprehensive literature review, analysis of current AI applications in smart grids, and examination of case studies to illustrate the practical implementation and benefits of AI technologies in this field.",https://openalex.org/W4401588937,2024,Paula Cristina de Almeida Marques; Paulo Alexandre Oliveira,
Land Resource Management Information Platform Based on Artificial Intelligence Technology,"Cloud computing, big data and artificial intelligence have become the hot spots in the current information system construction, and the integration of artificial intelligence into the information management platform has become a new means. This paper mainly studies the land resource management information platform based on artificial intelligence technology. In this paper, the concept of artificial intelligence is first described. Secondly, combined with the key technologies and daily business requirements, the system requirements analysis was completed, and the specific functional requirements of the platform were deeply analyzed through the use case diagram. Thirdly, combined with the system design principles, the system logic structure and function module design are completed. Finally, combined with the system design and implementation, the system test is completed from the two aspects of system function test and performance test. The results of function test and performance test show that the land resource management information fully meets the expected design requirements and all the performance indicators meet the requirements.",https://openalex.org/W3145783186,2021,Ziyi Jiang,Yunnan Agricultural University
Disruptive Technologies and Operations Management in the Industry 4.0 Era and Beyond,"In the Industry 4.0 era, automation and data analytics emerge as the major forces to enhance efficiency in operations management (OM). Disruptive technologies, such as artificial intelligence, robotics, blockchain, 3D printing, 5G, Internet‐of‐Thing, digital twins, and augmented reality, are widely applied. They potentially will bring a radical change to real world operations. In this study, we first explore several major disruptive technologies, examine the corresponding OM studies, and highlight their current applications in the industry. Then, we discuss the pros and cons associated with the use of these technologies and uncover the potential human–machine conflicting areas. After that, we propose measures which may be able to achieve human–machine reconciles in the coming Industry 5.0 era. A concept of “sustainable social welfare” which includes worker welfare, privacy, etc. is proposed and the roles played by policy makers are also discussed. Finally, a future research agenda, which covers topics in both the Industry 4.0 and Industry 5.0 eras, is established.",https://openalex.org/W3212055144,2021,Tsan‐Ming Choi; Subodha Kumar; Xiaohang Yue,National Taiwan University; Temple University; Northeastern University
"""Anti-corruption Management Mechanisms and the Construction of a Security landscape in the Financial Sector of the EU Economic System Against the Background of Challenges to European Integration: Implications for Artificial Intelligence Technologies""","""The article is devoted to modern topical theoretical and practical problems of interaction between international anti-corruption and financial and legal norms in the field of preventing the financing of terrorism, corruption and money laundering in the integrated EU financial market. It is shown that the current mechanisms of foreign exchange control and banking supervision of the EU over the financial transactions of entities need to be strengthened by anti-corruption measures. The steps taken in this direction, as well as the current regulatory documents and agreements, are analyzed. International legal norms against financial crime, corruption and terrorist financing should be successfully translated into the norms of national administrative, financial, anti-corruption law within the common space of the EU economic system in order to provide the necessary security landscape. The security challenges and threats associated with the increasing digitalization of financial markets, as well as the possibilities of using artificial intelligence tools to combat corruption, are considered.""",https://openalex.org/W4366760064,2023,Khalel Kh. Kussainov,Aktobe Regional State University named after K.Zhubanov
Research on the Challenge of Computer Artificial Intelligence Technology to Financial Risk Management,"Abstract Artificial intelligence is widely used in people’s lives. With the popularity of artificial intelligence, the financial industry has also ushered in reforms. With other technical support, the integration of artificial intelligence technology has formed a new model of financial industry development, that is,“ Internet + big data + artificial intelligence + financial risk control”. It has gradually become popular in this rapidly developing society. And this new model will be the main form of financial risk control in the future. This paper mainly sorts out the application status of artificial intelligence in the financial field, and it analyzes its advantages and problems.",https://openalex.org/W3193908400,2021,Wei Liu; Yijiang Hong,Sichuan University
Technological disruptions in services: lessons from tourism and hospitality,"Purpose Technological disruptions such as the Internet of Things and autonomous devices, enhanced analytical capabilities (artificial intelligence) and rich media (virtual and augmented reality) are creating smart environments that are transforming industry structures, processes and practices. The purpose of this paper is to explore critical technological advancements using a value co-creation lens to provide insights into service innovations that impact ecosystems. The paper provides examples from tourism and hospitality industries as an information dependent service management context. Design/methodology/approach The research synthesizes prevailing theories of co-creation, service ecosystems, networks and technology disruption with emerging technological developments. Findings Findings highlight the need for research into service innovations in the tourism and hospitality sector at both macro-market and micro-firm levels, emanating from the rapid and radical nature of technological advancements. Specifically, the paper identifies three areas of likely future disruption in service experiences that may benefit from immediate attention: extra-sensory experiences, hyper-personalized experiences and beyond-automation experiences. Research limitations/implications Tourism and hospitality services prevail under varying levels of infrastructure, organization and cultural constraints. This paper provides an overview of potential disruptions and developments and does not delve into individual destination types and settings. This will require future work that conceptualizes and examines how stakeholders may adapt within specific contexts. Social implications Technological disruptions impact all facets of life. A comprehensive picture of developments here provides policymakers with nuanced perspectives to better prepare for impending change. Originality/value Guest experiences in tourism and hospitality by definition take place in hostile environments that are outside the safety and familiarity of one’s own surroundings. The emergence of smart environments will redefine how customers navigate their experiences. At a conceptual level, this requires a complete rethink of how stakeholders should leverage technologies, engage and reengineer services to remain competitive. The paper illustrates how technology disrupts industry structures and stimulates value co-creation at the micro and macro-societal level.",https://openalex.org/W2923469844,2019,Dimitrios Buhalis; Tracy Harwood; Vanja Bogicevic,Bournemouth University; De Montfort University; The Ohio State University
Applications of Artificial Intelligence in Agriculture: A Review,"The application of Artificial Intelligence (AI) has been evident in the agricultural sector recently. The sector faces numerous challenges in order to maximize its yield including improper soil treatment, disease and pest infestation, big data requirements, low output, and knowledge gap between farmers and technology. The main concept of AI in agriculture is its flexibility, high performance, accuracy, and cost-effectiveness. This paper presents a review of the applications of AI in soil management, crop management, weed management and disease management. A special focus is laid on the strength and limitations of the application and the way in utilizing expert systems for higher productivity.",https://openalex.org/W2967464015,2019,Ngozi Clara Eli-Chukwu,"Alex Ekwueme Federal University, Ndufu-Alike"
[Retracted] Global Increase in Breast Cancer Incidence: Risk Factors and Preventive Measures,"Breast cancer is a global cause for concern owing to its high incidence around the world. The alarming increase in breast cancer cases emphasizes the management of disease at multiple levels. The management should start from the beginning that includes stringent cancer screening or cancer registry to effective diagnostic and treatment strategies. Breast cancer is highly heterogeneous at morphology as well as molecular levels and needs different therapeutic regimens based on the molecular subtype. Breast cancer patients with respective subtype have different clinical outcome prognoses. Breast cancer heterogeneity emphasizes the advanced molecular testing that will help on‐time diagnosis and improved survival. Emerging fields such as liquid biopsy and artificial intelligence would help to under the complexity of breast cancer disease and decide the therapeutic regimen that helps in breast cancer management. In this review, we have discussed various risk factors and advanced technology available for breast cancer diagnosis to combat the worst breast cancer status and areas that need to be focused for the better management of breast cancer.",https://openalex.org/W4224284036,2022,Dharambir Kashyap; Deeksha Pal; Riya Sharma,Post Graduate Institute of Medical Education and Research
Construction with digital twin information systems,"Abstract The concept of a “digital twin” as a model for data-driven management and control of physical systems has emerged over the past decade in the domains of manufacturing, production, and operations. In the context of buildings and civil infrastructure, the notion of a digital twin remains ill-defined, with little or no consensus among researchers and practitioners of the ways in which digital twin processes and data-centric technologies can support design and construction. This paper builds on existing concepts of Building Information Modeling (BIM), lean project production systems, automated data acquisition from construction sites and supply chains, and artificial intelligence to formulate a mode of construction that applies digital twin information systems to achieve closed loop control systems. It contributes a set of four core information and control concepts for digital twin construction (DTC), which define the dimensions of the conceptual space for the information used in DTC workflows. Working from the core concepts, we propose a DTC information system workflow—including information stores, information processing functions, and monitoring technologies—according to three concentric control workflow cycles. DTC should be viewed as a comprehensive mode of construction that prioritizes closing the control loops rather than an extension of BIM tools integrated with sensing and monitoring technologies.",https://openalex.org/W3107782157,2020,Rafael Sacks; Ioannis Brilakis; Ergo Pikas,University of Cambridge; Technion – Israel Institute of Technology; Aalto University
Modern Engineering Project Management Based on Deep Artificial Intelligence Technology,"The industrial revolution has driven rapid transformation and development across the industry, and engineering project management is facing opportunities and challenges.With the outbreak of new coronavirus, the process of modern engineering project management has been promoted significantly.Artificial intelligence technology has been widely used for analysis and the large quantity of data in engineering projects is complicated and dynamic.This paper focuses on the application of artificial intelligence technology in modern engineering project management from three aspects including application background, application value, and application suggestions, to promote the awareness of engineering project managers about deep artificial intelligence.",https://openalex.org/W4320509167,2022,Ailian Gao; Nolan Guillao ChuJia Liu; Ziping Yu,Hunan Institute of Technology; University of the Cordilleras; Nanjing Xiaozhuang University
Creating a Practical Transformational Change Management Model for Novel Artificial Intelligence–Enabled Technology Implementation in the Operating Room,Key CM strategies and a new CM model addressing the unique needs and characteristics of operating room novel technology implementation were identified and created. The new model may be customized and tested for individual institution and project's needs and characteristics.,https://openalex.org/W4307448347,2022,Tianqi Gao Smith; Hamid Norasi; Kelly M. Herbst,Mayo Clinic in Arizona; Mayo Clinic
The economics and management of intellectual property: towards intellectual capitalism,"This volume focuses on intellectual property and charts the global transition towards intellectual capitalism with technology-based corporations as prime movers. It offers a comprehensive overview of the history and fundamentals of intellectual property as well as an introduction to the field. The author seeks to shed light on the economics and management of intellectual property in large corporations in Europe, Japan and the USA. Special emphasis is given to strategies for the acquisition and commercialization of new technologies, patent strategies and strategies for secrecy and trademark, technology intelligence and corporate management of intellectual property. The book includes an in-depth study of leading large corporations in Japan - Canon, Hitachi, Toshiba and Sony. In conclusion, it explores the possible evolution of intellectual property management towards a distributed intellectual capital management in the context of a wider transition to intellectual capitalism, fuelled by new technologies in general and new infocom technologies in particular.",https://openalex.org/W1497625586,2000,Ove Granstrand,
Using AI in knowledge management: knowledge bases and ontologies,"This article looks at the use of artificial intelligence in knowledge management systems, focusing on such AI-related technologies as knowledge bases and ontologies. Because these technologies both depend on particular settings, the author discusses knowledge management as practiced at three major professional services firms.",https://openalex.org/W2158014992,1998,Daniel E. O’Leary,University of Southern California
Technology Acceptance of Business Intelligence and Customer Relationship Management Systems within Institutions Operating in Capital Markets,"Business intelligence (BI) and Customer Relationship Management (CRM) projects are difficult to maintain and manage, since they consist of different systems that need to work together in a collaborative manner. For example, inaccurate data from one location can cause most reports to be generated incorrectly, which in turn can cause meaningless results. This situation may result in the failure of BI and CRM systems. This is most likely due to the fact that the process is not planned correctly and needs are not adequately analyzed. For this reason, systems must always be checked and maintained. Additionally, users' acceptance of this new technology must be examined. In this study, techniques of using BI applications in CRM were examined. While previous studies on the adoption of BI and CRM systems in businesses have used TAM or variants formed from the variables of different theoretical models, in this study an alternative model was proposed based on the Technology Acceptance Model 3 (TAM3), which is an extended form of the TAM's social impact processes and cognitive impact process variables. Thus, this study aims to fill in the gap in the literature and provide a detailed explanation. In order to investigate users' acceptance of BI and CRM systems, an adapted questionnaire was administered to 90 employees at institutions operating in capital markets. Findings showed that by order of importance perceived usefulness, perceived ease of use and behavioral intention to use are the key constructs for promoting the usage of BI and CRM systems in such sectoral context. Besides this, the author offered suggestions to technology managers and institutions operating in the capital markets concerning new technology, adoption of BI and CRM systems under similar sectoral circumstances.",https://openalex.org/W2803474310,2018,Ferdi Sönmez,
